calories,carbohydrates,cholesterol,cook_time,course,cuisine,description,fat,fiber,full_name,image_url,ingredient_count,ingredients,instructions,monounsaturated_fat,notes,polyunsaturated_fat,potassium,prep_time,protein,recipe_id,saturated_fat,serving,sodium,sugar,title
156,14,,10,Main Course,Mexican,"These , are the perfect summer staple. They’re spicy, sweet, and easily made in the air fryer. With a homemade salsa and a blackening seasoning that goes on everything, this is one taco recipe you'll want to save. ",2,,Blackened Chicken Tacos with Pineapple Salsa,https://ohsnapmacros.com/wp-content/uploads/2022/05/BlackenedChickenTacos-07-300x300.jpg,16,"[{'amount': '1.5', 'unit': 'lbs.', 'name': 'boneless skinless chicken breast, raw', 'notes': None}, {'amount': '1', 'unit': 'tbsp.', 'name': 'smoked paprika', 'notes': None}, {'amount': '1', 'unit': 'tbsp.', 'name': 'garlic powder', 'notes': None}, {'amount': '1', 'unit': 'tsp..', 'name': 'salt', 'notes': None}, {'amount': '1', 'unit': 'tsp.', 'name': 'black pepper', 'notes': None}, {'amount': '1/4 to 1', 'unit': 'tsp.', 'name': '\xa0tsp cayenne pepper', 'notes': None}, {'amount': '1', 'unit': 'cup', 'name': '\xa0(150g) chopped pineapple', 'notes': None}, {'amount': '2', 'unit': None, 'name': 'medium vine tomatoes (200g)', 'notes': None}, {'amount': '1/2', 'unit': 'cup', 'name': '(50g) thinly sliced red onion', 'notes': None}, {'amount': '1/4', 'unit': 'cup', 'name': 'chopped cilantro (loosely packed)', 'notes': None}, {'amount': '1/2', 'unit': 'tbsp.', 'name': 'lime juice', 'notes': None}, {'amount': '1/4', 'unit': 'tsp.', 'name': 'salt', 'notes': None}, {'amount': None, 'unit': None, 'name': 'La Banderita Carb Counter Snack Size Tortillas', 'notes': None}, {'amount': None, 'unit': None, 'name': 'thinly sliced cabbage', 'notes': None}, {'amount': None, 'unit': None, 'name': 'fresh chopped cilantro', 'notes': None}, {'amount': None, 'unit': None, 'name': 'la crema sauce of choice', 'notes': None}]","You will want to prep your salsa first and let it set in the fridge for at least 30 minutes before serving. Using a cutting board, chop all of your salsa ingredients and add them to a large bowl. Top with salt and lime. Cover, shake together well, and place in the fridge to marinate. ,Preheat the air fryer and prep your chicken and cut it into thin strips. For instructions on how to cook in the oven or BBQ see the above section. Add all the blackened seasoning ingredients to a bowl and combine with the chicken. Place chicken strips in a single layer to the air fryer pan and cook at 380 degrees Fahrenheit for 8 minutes.,While the chicken cooks finely slice your cabbage and any other toppings desired like cilantro, la crema or cotija cheese.,Brown your tortillas over medium-high heat. We like to throw them directly onto the stovetop flame. You can also broil them in the oven or toss them on the BBQ until they have dark golden brown marks. Top the tortillas with cabbage, Air Fryer Blackened Chicken, pineapple salsa, fresh cilantro, lime juice and crema.,Serve: this recipe makes 12 snack size tacos using La Banderita Snack Size tortillas. 1 tortilla, pinch of cabbage, approximately 1.5 oz. cooked chicken and approximately 30 grams of salsa.",,,,,30,21,19126,,12,,,Blackened Chicken Tacos
140,15,,20,"Appetizer, Main Course, Snack",American,"These ,are insanely good! Hawaiian rolls are filled with juicy chicken, melty mozzarella cheese and a homemade spinach pesto. A great party food, these cute little sliders make the perfect game day appetizer or easy dinner. Made with simple ingredients, this easy recipe will be one of your favorites!",5,0.1,Chicken Pesto Sliders Recipe,https://ohsnapmacros.com/wp-content/uploads/2022/12/ezgif.com-gif-maker-44-300x300.jpg,9,"[{'amount': '12', 'unit': None, 'name': ""pack Savory Buttery Rolls (King's Hawaiian)"", 'notes': None}, {'amount': '8', 'unit': 'slices', 'name': 'Deli Chicken (Dietz & Watson Southern Fried)', 'notes': None}, {'amount': '6', 'unit': 'slices', 'name': 'Low-Moisture Part-Skim Mozzarella Cheese', 'notes': None}, {'amount': '1-2', 'unit': None, 'name': '\xa0cloves of garlic', 'notes': None}, {'amount': '1', 'unit': 'cup', 'name': '\xa0fresh basil', 'notes': None}, {'amount': '1', 'unit': 'cup', 'name': '\xa0fresh spinach', 'notes': None}, {'amount': '1', 'unit': 'Tbsp.', 'name': 'water', 'notes': None}, {'amount': '1/4', 'unit': None, 'name': '\xa0lemon juiced', 'notes': None}, {'amount': None, 'unit': None, 'name': 'Salt and pepper', 'notes': None}]","Pre heat oven to 375 degrees Fahrenheit. Spray a 9×13 inch (or dish large enough to fit all rolls) baking dish with nonstick spray and set aside.,Slice Buttery Rolls through the center so you have a top and bottom leaving all 12 connected.,Top the bottom rolls evenly with sliced chicken and cheese. Lay four slices of chicken down first and top with the next 4 slices. Lay out 3 slices of cheese towards the top half (viewing the rolls connected by 4) and 3 slice along the bottom so they evenly overlap.,In a food processor or single smoothie blender add basil. spinach, garlic, lemon juice, salt and and pepper and blend until fully combined.,Brush the tops of the tops of the sliders with some of the fresh pesto. Pour the remaining pesto on top of the mozzarella cheese. Place the tops on the rolls. Option: sprinkle with dried minced onion, sesame seeds or everything but the bagel seasoning.,Place the rolls in the baking dish and CUT all 12 into individual rolls. Do this so that it's easy to pull apart since the meat overlaps and will need to be cut.,Loosely cover the rolls with foil and bake for 15 minutes. Remove the foil and let bake for an additional 5 minutes to crisp the rolls some.,Remove from the oven when the cheese has fully melted and serve. Enjoy your delicious chicken pesto sliders.",,,,,10,9,19100,,12,252,,Chicken Pesto Sliders
102,17,,6,"Appetizer, Main Course, Snack",American,"!! Using the easiest , recipe, ever, and combining it with the magic of an air fryer .. I now present you Air Fryer,!! ",1,,Air Fryer Egg Rolls,https://ohsnapmacros.com/wp-content/uploads/2022/12/ezgif.com-gif-maker-80-300x300.jpg,13,"[{'amount': '1', 'unit': 'lbs.', 'name': 'ground turkey ', 'notes': '99/1'}, {'amount': '1/2', 'unit': 'tbsp.', 'name': None, 'notes': None}, {'amount': '1.5', 'unit': 'cups', 'name': '\xa0broccoli slaw mix ', 'notes': '100g'}, {'amount': '1', 'unit': 'tbsp.', 'name': 'minced garlic', 'notes': None}, {'amount': '6.5', 'unit': 'tbsp.', 'name': None, 'notes': '90g'}, {'amount': '3', 'unit': None, 'name': 'heaping cups sliced cabbage', 'notes': '150g'}, {'amount': '1/2', 'unit': 'can', 'name': 'water chestnuts, chopped', 'notes': '75g'}, {'amount': '1', 'unit': 'tsp', 'name': 'sriracha', 'notes': None}, {'amount': '1/2', 'unit': 'tsp', 'name': 'ground ginger', 'notes': None}, {'amount': '1-2', 'unit': None, 'name': '\xa0chopped green onions', 'notes': None}, {'amount': None, 'unit': None, 'name': 'salt and pepper', 'notes': None}, {'amount': None, 'unit': None, 'name': 'additional sriracha as needed', 'notes': None}, {'amount': '24', 'unit': None, 'name': 'Egg Roll Wrappers', 'notes': None}]","Spray cooking pan with nonstick and brown ground turkey in a pan over medium heat. Once browned add 1/2 tsp. sesame oil and stir.,If there is a lot of excess liquid from the meat, drain it prior to moving on.,Add minced garlic, broccoli slaw, coconut aminos to the turkey and stir. Simmer until broccoli is slightly soft. Add cabbage, water chestnuts, sriracha, ginger, salt and pepper. Stir and simmer until cabbage is wilted. Mix in chopped green onions.,Top with extra sriracha, drizzle of coconut aminos or sesame seeds.,Lay 1 egg roll wrapper flat with one of the 4 points pointed towards you. Place 32 grams (or full recipe weight divided by 24) in the bottom portion of the egg roll paper. Work from the corner closest to you roll the wrapper over the filling, tuck in the corners and continue to roll up like a burrito. Continue for all egg rolls.,Place eggs rolls in the basket / tray of the air fryer and cook at 400 for 6 minutes. Do not layer egg rolls, work in batches as needed.",,,,,10,8,19205,,24,,,Air Fryer Egg Rolls
398,31.7,,10,Main Course,Chinese,"Another protein packed meal! By adding zoodles and cabbage to these , noodles you get VOLUME, lots of nutritious volume. ",9,,Chicken Lo Mein,https://ohsnapmacros.com/wp-content/uploads/2022/12/ezgif.com-gif-maker-2022-11-09T160724.410-300x300.jpg,11,"[{'amount': '1.5', 'unit': 'lbs.', 'name': 'chicken breast, chopped into bite size cubes', 'notes': None}, {'amount': '2', 'unit': None, 'name': 'Medium\xa0zucchinis, zoodled', 'notes': None}, {'amount': '1', 'unit': 'tbsp.', 'name': None, 'notes': None}, {'amount': '125', 'unit': 'g', 'name': '\xa0sliced cabbage', 'notes': None}, {'amount': '1', 'unit': None, 'name': 'medium yellow bell pepper, sliced', 'notes': '140g'}, {'amount': '1', 'unit': 'tbsp.', 'name': 'minced garlic', 'notes': None}, {'amount': '75', 'unit': 'g', 'name': 'chopped water chestnuts, 1/2 container', 'notes': None}, {'amount': None, 'unit': None, 'name': 'salt and pepper', 'notes': None}, {'amount': '94', 'unit': 'g', 'name': '(one bundle) Lo Mein egg noodles, cooked (Wel Pac)', 'notes': None}, {'amount': '8', 'unit': 'tbsp.', 'name': '\xa0Kikkoman Stir-fry Sauce', 'notes': None}, {'amount': '1', 'unit': None, 'name': 'chopped green onion', 'notes': None}]","Cut zucchini into zoodles, lay out on a paper towel, sprinkle with salt and let them sweat while you cook.,In a wok or large pan, heat 1/2 tbsp. toasted sesame oil over medium heat. Once hot add chopped chicken, season with salt and pepper and cook until the chicken is cooked through, stirring occasionally to keep from burning. Add garlic, remining sesame oil, bell peppers and cook stirring occasionally until bell peppers begin to soften.,While the chicken is cooking, cook noodles in a separate pan according to package and drain.,Pat zoodles dry and add to pan along with cabbage, water chestnuts and 6 tbsp. of stir-fry sauce. Mix together well and separate the zoodles throughout the dish. Top with toasted sesame seeds and sriracha if desired or serve as is.,Tip: break noodles in half prior to cooking. This will make it easier to serve yourself a true serving vs. all noodles.",,,,,10,44.6,19272,,4,,,Chicken Lo Mein
499,57.1,,20,Main Course,American,"The best part about this combo is multiple meals. Plan to make your , early in the week and then make high protein mac and cheese, a couple days later. Combine the two and there you have it … Chili Mac and 3 different meals for the family to enjoy. Chili, Mac and Cheese and,.",16.7,,Macro Friendly Chili Mac,https://ohsnapmacros.com/wp-content/uploads/2022/12/ezgif.com-gif-maker-2022-11-09T162524.305-300x300.jpg,2,"[{'amount': '175', 'unit': 'g', 'name': 'Macro Friendly Instant Pot Chili', 'notes': None}, {'amount': '190', 'unit': 'g', 'name': 'Macro Mac and Cheese', 'notes': None}]",Mix together and ENJOY!,,,,,20,30.7,17417,,1,,,Macro Friendly Chili Mac
424,46,,25,Main Course,Mexican,"These , are easy, flavorful and 1 pan makes 4 days worth of food. Prep everything on Sunday and you’re ready to go for most of your week ahead.",7,,Spicy Sheet Pan Fajita Bowls,https://ohsnapmacros.com/wp-content/uploads/2022/12/ezgif.com-gif-maker-2022-11-09T162051.970-300x300.jpg,16,"[{'amount': '1.5', 'unit': 'lbs.', 'name': 'chicken breast, sliced into strips', 'notes': None}, {'amount': '1', 'unit': None, 'name': 'red bell pepper, sliced', 'notes': '140g'}, {'amount': '1', 'unit': None, 'name': 'orange bell pepper, sliced', 'notes': '140g'}, {'amount': '1', 'unit': None, 'name': 'red onion, sliced', 'notes': '290g'}, {'amount': '1', 'unit': 'tbsp.', 'name': '\xa0lime juice', 'notes': None}, {'amount': '1', 'unit': 'tbsp.', 'name': 'honey', 'notes': None}, {'amount': '1', 'unit': 'tbsp.', 'name': 'chili powder', 'notes': None}, {'amount': '1', 'unit': 'tbsp.', 'name': 'cumin', 'notes': None}, {'amount': '2', 'unit': 'tsp.', 'name': 'paprika', 'notes': None}, {'amount': '1', 'unit': 'tsp.', 'name': 'garlic powder', 'notes': None}, {'amount': '1', 'unit': 'tsp.', 'name': 'salt', 'notes': None}, {'amount': '1', 'unit': 'tsp.', 'name': 'pepper', 'notes': None}, {'amount': '360', 'unit': 'g', 'name': 'cooked basmati rice', 'notes': None}, {'amount': '2', 'unit': 'tbsp.', 'name': 'chopped cilantro', 'notes': None}, {'amount': None, 'unit': None, 'name': 'Juice of 1 lime', 'notes': None}, {'amount': None, 'unit': None, 'name': 'Pinch of salt', 'notes': None}]","Preheat over to 425.,For meal prepping and measuring purposes I split the chicken and veggies into 2 separate bowls. Mix all dry seasonings in a small bowl. Split in half. Add 1/2 the seasoning to the chicken and half to the peppers and onions. Add 1/2 tbsp of lime and 1/2 tbsp honey to each bowl. Mix to coat everything well.,Spray a baking sheet with cooking spray and spread out chicken and veggies to bake. Bake at 425 for 20-25 minutes until cooked through.,Combine rice, cilantro, lime and salt.,4 oz. cooked chicken 100g veggies 90g cilantro lime basmati rice 424 Cals: 46.4 C / 7.2 F / 45.4 P",,,,,10,45,19277,,4,,,Sheet Pan Fajita Bowls
301,31,,20,"Main Course, Snack",American,"These , are easy, flavorful and perfect for meal prep. With a homemade dressing, fresh veggies and high protein chicken, these wraps are customizable to your liking and perfect to bring to work or school.",4,,Honey Mustard Chicken Wraps,https://ohsnapmacros.com/wp-content/uploads/2022/12/ezgif.com-gif-maker-57-300x300.jpg,9,"[{'amount': '1', 'unit': 'lbs.', 'name': 'chicken breast, 2 breasts butterflied', 'notes': None}, {'amount': '4', 'unit': None, 'name': 'Tumaros White Protein wraps', 'notes': None}, {'amount': '4', 'unit': None, 'name': 'medium tomato slices', 'notes': None}, {'amount': None, 'unit': None, 'name': 'green leaf lettuce', 'notes': None}, {'amount': None, 'unit': None, 'name': 'sliced red onion', 'notes': None}, {'amount': '4', 'unit': 'Tbsp.', 'name': 'honey', 'notes': '85g'}, {'amount': '1/3', 'unit': 'cup', 'name': 'Dijon mustard', 'notes': '85g'}, {'amount': '1', 'unit': None, 'name': 'garlic clove', 'notes': 'minced'}, {'amount': None, 'unit': None, 'name': 'salt and black pepper', 'notes': None}]","Pre-heat oven to 375 degrees F. ,Remove chicken from package and butterfly the 2 breasts. Slice so that you have 4 thinly sliced chicken strips.,Place chicken on a baking sheet.,In a small bowl, mix together honey mustard sauce ingredients. Reserve a small bowl of honey mustard to topping your wrap. ,Pour the honey mustard over the chicken. Be sure to get both sides covered.,Bake 375 degrees F for 20 minutes until the chicken is fully cooked.,Remove chicken from oven and cut into strips. Coat in the honey mustard.,Assemble your wrap. Lay one wrap down and top with lettuce, tomato, onion, chicken, extra honey mustard sauce and roll into a wrap. Cut in half and enjoy.",,,,,10,45,19138,,4,,,Honey Mustard Chicken Wraps
374,38.4,,10,Main Course,American,"These , combine , and ,with a delicious and quick gravy for a … I said it … even better than KFC bowl!These bowls can be served upon cooking or reheated throughout the week as meal prep.You’ll be left with lots of gravy too so you can plan to grab some extra potatoes and whip up some Greek Mashed Potatoes for a side dish.",7.2,2,Copycat KFC Bowls,https://ohsnapmacros.com/wp-content/uploads/2022/12/ezgif.com-gif-maker-100-300x300.jpg,10,"[{'amount': '100', 'unit': 'g', 'name': None, 'notes': None}, {'amount': '185', 'unit': 'g', 'name': None, 'notes': None}, {'amount': '50', 'unit': 'g', 'name': 'canned corn', 'notes': None}, {'amount': '50', 'unit': 'g', 'name': 'gravy', 'notes': None}, {'amount': '2', 'unit': 'Tbsp.', 'name': 'butter', 'notes': None}, {'amount': '1/4', 'unit': 'cup', 'name': 'flour', 'notes': None}, {'amount': '1', 'unit': 'cup', 'name': 'chicken broth', 'notes': None}, {'amount': '1', 'unit': 'cup', 'name': 'beef broth', 'notes': None}, {'amount': None, 'unit': None, 'name': 'pinch of salt', 'notes': None}, {'amount': None, 'unit': None, 'name': 'pinch on garlic powder', 'notes': None}]","Assemble your bowl – mashes potatoes, chicken, corn and top with gravy.,Serve immediately or prep for meal prep. Reheats very well.,Melt the butter in a pan over medium heat. Add the flour and stir until combined and lumpy.,Very slowly add small amounts of beef broth while whisking the flour mixture. This will help break up the clumps along the way. Once you have used all the beef broth begin adding the chicken broth.,Season with salt and garlic powder and whisk until the gravy has thickened and lump free.,NOTE! If you end up with lumps (gravy can be tricky) you can toss this in the blender or use a immersion blender for a few pulses and it'll be lump free.",,,,,5,47.9,17395,,1,497,,Copycat KFC Bowls
245,16.3,,15,Main Course,"American, Chinese","Full of flavor, protein and ready in under 30 minutes, this , is a great meal prep or easy weeknight meal option.,Serve over rice. For a low carb option serve over Healthy Noodles (I find these at Costco in the fridge section), zoodles or riced cauliflower.",1.6,,Turkey Stir-Fry,https://ohsnapmacros.com/wp-content/uploads/2022/12/ezgif.com-gif-maker-2022-11-09T155828.371-300x300.jpg,11,"[{'amount': '1', 'unit': 'lbs.', 'name': '\xa0ground turkey (99% lean)', 'notes': None}, {'amount': '100', 'unit': 'g', 'name': 'snow peas, chopped', 'notes': None}, {'amount': '100', 'unit': 'g', 'name': 'baby carrots, sliced', 'notes': None}, {'amount': '100', 'unit': 'g', 'name': 'broccoli, chopped', 'notes': None}, {'amount': '100', 'unit': 'g', 'name': 'whole baby corn, chopped in 1/2', 'notes': None}, {'amount': '70', 'unit': 'g', 'name': 'water chestnuts, sliced (~1/2 can)', 'notes': None}, {'amount': '1/4', 'unit': 'cup', 'name': 'water', 'notes': None}, {'amount': '8', 'unit': 'tbsp.', 'name': '\xa0Kikkoman Stir-Fry sauce *', 'notes': None}, {'amount': '1', 'unit': 'tbsp.', 'name': None, 'notes': None}, {'amount': None, 'unit': None, 'name': 'Pinch of crushed red pepper', 'notes': None}, {'amount': None, 'unit': None, 'name': 'Salt and pepper', 'notes': None}]","Heat a pan over medium heat and spray with nonstick cooking spray.,Add turkey to the pan. I like to smash the turkey down into the pan, season with salt and pepper and let it brown on each side prior to breaking into pieces. Season with salt and pepper and brown.,Once turkey is cooked through add broccoli, carrots, 1/4 cup of water and steam the veggies until slightly soft, stirring frequently. Once the carrots begin to soften add corn, peas, water chestnuts, crushed red pepper to taste and fresh cracked pepper.,Add stir-fry sauce and chili garlic sauce. Mix together well and serve over rice.,For a low carb option serve over zoodles, Healthy Noodles or riced cauliflower.",,,,,10,37.1,17401,,3,,,Turkey Stir-Fry
382,32.8,,10,Main Course,Mexican,"You won’t be able to stop eating these ,! Sweet and spicy, amazing macros and under 30 minutes!",10.1,,Fajita Shrimp Burritos,https://ohsnapmacros.com/wp-content/uploads/2022/12/ezgif.com-gif-maker-95-300x300.jpg,13,"[{'amount': '5', 'unit': 'oz.', 'name': '\xa0deveined and shelled shrimp (raw)', 'notes': None}, {'amount': '1/4', 'unit': 'tsp.', 'name': 'cumin', 'notes': None}, {'amount': '1/4', 'unit': 'tsp.', 'name': 'chili powder ', 'notes': None}, {'amount': '1/4', 'unit': 'tsp.', 'name': 'onion powder ', 'notes': None}, {'amount': '1/4', 'unit': 'tsp. ', 'name': 'garlic powder ', 'notes': None}, {'amount': '1/4', 'unit': 'tsp.', 'name': 'salt ', 'notes': None}, {'amount': '20', 'unit': 'g', 'name': 'sliced green bell pepper \u2063', 'notes': None}, {'amount': '20', 'unit': 'g', 'name': 'sliced red onion \u2063', 'notes': None}, {'amount': '20', 'unit': 'g', 'name': 'plain nonfat Greek yogurt \u2063', 'notes': None}, {'amount': '1', 'unit': None, 'name': 'lime\xa0wedge \u2063', 'notes': None}, {'amount': '50', 'unit': 'g', 'name': 'basmati rice \u2063', 'notes': 'cooked'}, {'amount': None, 'unit': None, 'name': 'Jalapeno hot sauce \u2063or any green hot sauce', 'notes': None}, {'amount': '1', 'unit': None, 'name': ""Joseph's Bakery Lavash"", 'notes': None}]","Peel and devein shrimp. Add seasonings and coat well.,Sauté onions and peppers on greased pan over medium heat until tender and browned. Push to one side and add shrimp.,Cook shrimp ~ 3 mins each side until cooked through. ⁣While the shrimp cooks mix Greek yogurt and lime juice and set aside. ⁣,Once the shrimp has cooked, assemble your burritos. Rice. Shrimp. Veggies. Sauce. Hot sauce.,⁣Roll in a wrap or tortilla, spray the outside of the wrap or tortillas with cooking spray and sear in a warm pan until golden brown.",,,,,15,24.7,19249,,1,,,Fajita Shrimp Burritos
292,16,,35,Main Course,American,"Busy weeknights get a whole lot better with this ,. This comfort food classic has tender chicken, fresh veggies, and a buttery cream sauce making this easy dinner recipe one you won't want to miss. ",11,,Creamy Chicken and Veggie Casserole,https://ohsnapmacros.com/wp-content/uploads/2022/01/chickenandvegcasserole-04-300x300.jpg,12,"[{'amount': '1.5', 'unit': 'lbs.', 'name': 'raw chicken breast, chopped into bite size pieces', 'notes': None}, {'amount': '1/2', 'unit': None, 'name': 'yellow onion, chopped ', 'notes': '160g'}, {'amount': '1', 'unit': None, 'name': '\xa0red bell pepper, cut into strips ', 'notes': '200g'}, {'amount': '1', 'unit': None, 'name': 'green bell pepper, cut into slices', 'notes': '130g'}, {'amount': '1', 'unit': None, 'name': 'package of frozen spinach, defrosted (10 oz. package) and water drained', 'notes': None}, {'amount': '2', 'unit': 'cups', 'name': 'sliced cremini mushrooms', 'notes': '160g'}, {'amount': '1', 'unit': 'can', 'name': '98% fat free condensed cream of mushroom soup', 'notes': '10.5oz can'}, {'amount': '1', 'unit': 'cup', 'name': 'non fat sour cream ', 'notes': '250g'}, {'amount': '2', 'unit': 'tbsp.', 'name': 'unsalted butter', 'notes': None}, {'amount': '1', 'unit': 'tsp.', 'name': 'minced garlic', 'notes': None}, {'amount': '1', 'unit': 'tsp.', 'name': 'paprika', 'notes': None}, {'amount': None, 'unit': None, 'name': 'salt and pepper', 'notes': None}]","Pre heat the oven to 375. Slice and chop your veggies. Add the frozen spinach to a bowl of hot water (keep in the packaging) to let thaw while you cook your veggies.,Heat a large pan over medium heat and add butter to melt. Once the butter has melted add garlic, peppers, onions and mushrooms to the pan and cook. Allow to cook until the onions are translucent and peppers begin to soften. Approx. 5-10 minutes. Add thawed and drained spinach. To drain the water from the spinach just simply squeeze it out of the bag. Be careful though the bag can pop and a disaster follows. Mix the spinach in with the vegetables.,While the vegetables cook, cut your chicken into bite sized pieces. Alternatively, for tracking purposes, you can cut your chicken into 4 oz. cutlets and place on top at the end to cook vs. mixed in with the vegetables.,When the vegetables are done, add cream of mushroom soup, sour cream, paprika, salt and pepper. I have left salt and pepper to your discretion, you can always add to the meal if needed.,Once the mixture is well mixed, add your raw chicken and mix well to combine.,Spray and baking dish with non stick spray and add the mixture to the dish. Bake at 375 for 20 minutes.,If you place the chicken on top vs. mixed it be sure to cook until the chicken is fully cooked.,Serve alone, over noodles, zoodles, rice or cauliflower rice.,Enjoy and let me know how you like it!",,,,,15,31,19231,,6,,,Creamy Chicken and Veggie Casserole
145,2,,30,Main Course,American," is spicy, delicious and so easy! Made with homemade cajun seasoning and ready in the air fryer in under 10 minutes, you'll have a great prepped protein for all your meal prep needs. ",3,,Air Fryer Blackened Chicken,https://ohsnapmacros.com/wp-content/uploads/2021/12/DSC02639-1-300x300.jpg,6,"[{'amount': '1', 'unit': 'lbs.', 'name': '\xa0chicken breast', 'notes': None}, {'amount': '1', 'unit': 'Tbsp.', 'name': 'smoked paprika', 'notes': None}, {'amount': '1', 'unit': 'Tbsp.', 'name': 'garlic powder', 'notes': None}, {'amount': '1', 'unit': 'tsp.', 'name': '\xa0salt', 'notes': None}, {'amount': '1/2', 'unit': 'tsp.', 'name': 'black pepper', 'notes': None}, {'amount': '1/4 to 1', 'unit': 'tsp.', 'name': 'cayenne pepper', 'notes': None}]","Mix seasonings in a deep mixing bowl and set aside.,Slice chicken breast into strips. Add chicken to bowl of seasonings and mix together well to evenly coat.,Preheat air fryer. Lay chicken in air fryer without any pieces overlapping. Cook at 380 for 8 minutes.,You can also pan sear, bake or BBQ this chicken. If baking – either cut into strips or leave in whole breasts and bake at 375 for approx. 20-25 minutes until cooked through and no longer pink. If BBQing – pound chicken breasts to approximately 1/2 inch thick. Top with the seasonings and coat well on all sides. BBQ on both sides until cooked through, approximately 4-5 minutes each side. If pan searing – suggest cutting into strips and searing a hot cast iron until cooked through.",,,,,10,26,19246,,4,,,Air Fryer Blackened Chicken
