calories,carbohydrates,cholesterol,cook_time,course,cuisine,description,fat,fiber,full_name,image_url,ingredient_count,ingredients,instructions,monounsaturated_fat,notes,polyunsaturated_fat,potassium,prep_time,protein,recipe_id,saturated_fat,serving,sodium,sugar,title
418,52.5,70,30,Main Course,American,"These , are filled with lean protein, fiber and so much flavor from a homemade peanut sauce. Made with kale and sweet potatoes, these healthy bowls are the best way to meal prep or enjoy an easy weeknight dinner. ",4.6,10.4,High Protein Ground Turkey Bowls with Peanut Sauce,https://ohsnapmacros.com/wp-content/uploads/2023/01/groundturkeybowls-1-1-300x300.jpg,25,"[{'amount': '1 ', 'unit': 'lb.', 'name': 'lean ground turkey', 'notes': '99/1'}, {'amount': '1', 'unit': 'tsp.', 'name': 'chili powder', 'notes': None}, {'amount': '1', 'unit': 'tsp.', 'name': 'smoked paprika', 'notes': None}, {'amount': '1/4', 'unit': 'tsp.', 'name': 'ground turmeric ', 'notes': None}, {'amount': '2', 'unit': None, 'name': 'large sweet potatoes, chopped', 'notes': '948g raw'}, {'amount': '3', 'unit': 'cups', 'name': 'kale, chopped', 'notes': '1 large bunch'}, {'amount': '1/2', 'unit': None, 'name': 'lemon, juiced', 'notes': None}, {'amount': '1', 'unit': 'tsp.', 'name': 'olive oil', 'notes': None}, {'amount': '1/2', 'unit': None, 'name': 'english cucumber, sliced', 'notes': None}, {'amount': '1.5', 'unit': 'cups', 'name': 'cherry tomatoes ', 'notes': None}, {'amount': '1', 'unit': 'cup', 'name': 'sliced carrots', 'notes': None}, {'amount': None, 'unit': None, 'name': 'salt and black pepper ', 'notes': None}, {'amount': '1/2', 'unit': 'cup', 'name': '+ 2 Tbsp. powdered peanut butter PB2 ', 'notes': '52g'}, {'amount': '1/4', 'unit': 'cup', 'name': 'water', 'notes': None}, {'amount': '2', 'unit': 'Tbsp.', 'name': 'lite maple syrup', 'notes': None}, {'amount': '1/2', 'unit': None, 'name': 'lemon, juiced', 'notes': None}, {'amount': None, 'unit': None, 'name': 'dash of cayenne pepper ', 'notes': 'to taste'}, {'amount': None, 'unit': None, 'name': 'pinch of salt ', 'notes': None}, {'amount': '1/2', 'unit': 'cup', 'name': 'apple cider vinegar', 'notes': None}, {'amount': '1', 'unit': 'Tbsp.', 'name': 'honey', 'notes': None}, {'amount': '1 1/2', 'unit': 'tsp. ', 'name': 'kosher salt', 'notes': None}, {'amount': '1', 'unit': 'cup', 'name': 'water', 'notes': None}, {'amount': '1', 'unit': None, 'name': 'red onion', 'notes': 'sliced'}, {'amount': '3', 'unit': None, 'name': 'garlic cloves', 'notes': 'whole'}, {'amount': '1', 'unit': 'Tbsp. ', 'name': 'black peppercorns ', 'notes': None}]","Whisk apple cider vinegar, honey, salt, and 1 cup water in a small bowl until honey and salt dissolve. Place the red onion, garlic and peppercorns in a mason jar with a tight-fitting lid; pour the vinegar mixture over top and let it sit at room temperature for at least 1 hour.,Pre-heat the oven to 425 degrees Fahrenheit. Wash and chop the sweet potatoes into bite size pieces, add to a baking sheet prayed with nonstick cooking spray. Spray the potatoes with cooking spray and season with salt and pepper. Roast for 25-30 minutes until fork tender and browned. ,add the chopped potatoes to a pre-heated air fryer pan. Cook at 400 degrees Fahrenheit for 10-15 minutes until fork tender and browned. Shake the basket halfway through. I personally prefer roasting in the oven because you may need to work in batched with the air fryer depending on the size of your basket. ,While the potatoes roast cook the ground turkey. Heat a pan over medium, spray with cooking spray and add the ground turkey. Using a spatula break the turkey into bite size pieces as it cooks. Cook until it is fully cooked through and no longer pink in the center, approximately 5 minutes. Add the chili powder, smoked paprika and ground turmeric. Stir together to evenly coat and remove from the heat. ,Remove the kale from the stems by slicing along the side of the stem and discarding the stem. Chop into bite size pieces and rinse. Add the rinsed and dried kale to a bowl with the olive oil, salt and lemon juice and using your hands massage the oil into the kale. You will start to notice the texture of the kale changes, softens and shrinks. Once you have massaged the kale for a few minutes and it has decreased in size by about half set aside. ,Combine the powdered peanut butter and water in a bowl and forming a peanut butter paste. Add the remaining ingredients to the bowl and mix together well to combine. Set aside until you’re ready to assemble your bowls. If you want the sauce to be any thinner just add more water. ,Assemble your ground turkey bowls. As always it’s best to weigh your final weights and divide by the numbers of servings for accurate measurements. Ex. weigh your roasted sweet potatoes in grams and divide by 4, that’s how many grams each bowl gets.,Each bowl gets the following: 1/4 ground turkey (approx. 90 grams), 1/4 roasted sweet potatoes (approx. 155 grams), 1/4 kale salad, 4 cherry tomatoes, 4 cucumber slices, 1/4 cup sliced carrots, 37 grams peanut sauce, pickled red onions (if using). ,Nutrition facts without sweet potatoes: 252 calories 38 P / 19 C / 4 F ,Nutrition facts with sweet potatoes: 418 calories 42 P / 52 C / 5 F ",0.8,,0.1,1196,10,42,26035,0.2,4,288.7,23.8,Ground Turkey Bowls
44,1,,35,"Breakfast, Snack",American,"These homemade, are a meal prep must-have! Made with egg whites, cottage cheese, veggies and turkey sausage, these creamy bites are high protein, low-carb and totally delicious. This recipe makes 24 little egg bites to make breakfast a breeze all week. ",2,,Cheesy Oven Baked Egg White Bites with Turkey Sausage,https://ohsnapmacros.com/wp-content/uploads/2024/02/eggwhitebites-20-300x300.jpg,6,"[{'amount': '1', 'unit': 'lb.', 'name': None, 'notes': 'Jeannie-O'}, {'amount': '1', 'unit': 'large', 'name': 'bell pepper', 'notes': 'chopped'}, {'amount': '1', 'unit': 'cup', 'name': 'spinach', 'notes': 'chopped'}, {'amount': '16', 'unit': 'oz.', 'name': 'liquid egg whites', 'notes': None}, {'amount': '1/2', 'unit': 'cup', 'name': 'low-fat cottage cheese', 'notes': None}, {'amount': '2', 'unit': 'oz.', 'name': 'shredded gruyere cheese', 'notes': 'or any preferred cheese'}]","Preheat oven to 350 degrees F. Prep muffin pans by placing each silicone pan on a baking sheet or spray muffin trays well with non-stick spray.,In a skillet over medium heat, cook the turkey, breaking into bite sized pieces until browned. Add the bell peppers and sauté until softened. Add the spinach and stir to wilt. Drain any excess liquid. ,Place each silicone muffin pan on a baking sheet or spray muffin trays well with non-stick spray. Evenly distribute the turkey mixture between the 24 muffin cups. ,In a blender combine the egg whites and cottage cheese. Blend until the cottage cheese is smooth. ,Evenly distribute the egg white mixture between to each cup followed by the shredded cheese over the 24 cups. Using a spoon slightly stir each cup to spread the cheese throughout vs. just on top. ,Bake in a preheated oven at 350 degrees Fahrenheit for 30-35 minutes until the eggs are cooked through and no longer runny. ,If baking one tray at a time or halving the recipe bake for 15-20 minutes or until the eggs are fully cooked through and no longer runny. ",,or any preferred cheese,,27,10,6,42183,1,24,139,,Egg White Bites
245,16.3,,15,Main Course,"American, Chinese","Full of flavor, protein and ready in under 30 minutes, this , is a great meal prep or easy weeknight meal option.,Serve over rice. For a low carb option serve over Healthy Noodles (I find these at Costco in the fridge section), zoodles or riced cauliflower.",1.6,,Turkey Stir-Fry,https://ohsnapmacros.com/wp-content/uploads/2022/12/ezgif.com-gif-maker-2022-11-09T155828.371-300x300.jpg,11,"[{'amount': '1', 'unit': 'lbs.', 'name': '\xa0ground turkey (99% lean)', 'notes': None}, {'amount': '100', 'unit': 'g', 'name': 'snow peas, chopped', 'notes': None}, {'amount': '100', 'unit': 'g', 'name': 'baby carrots, sliced', 'notes': None}, {'amount': '100', 'unit': 'g', 'name': 'broccoli, chopped', 'notes': None}, {'amount': '100', 'unit': 'g', 'name': 'whole baby corn, chopped in 1/2', 'notes': None}, {'amount': '70', 'unit': 'g', 'name': 'water chestnuts, sliced (~1/2 can)', 'notes': None}, {'amount': '1/4', 'unit': 'cup', 'name': 'water', 'notes': None}, {'amount': '8', 'unit': 'tbsp.', 'name': '\xa0Kikkoman Stir-Fry sauce *', 'notes': None}, {'amount': '1', 'unit': 'tbsp.', 'name': None, 'notes': None}, {'amount': None, 'unit': None, 'name': 'Pinch of crushed red pepper', 'notes': None}, {'amount': None, 'unit': None, 'name': 'Salt and pepper', 'notes': None}]","Heat a pan over medium heat and spray with nonstick cooking spray.,Add turkey to the pan. I like to smash the turkey down into the pan, season with salt and pepper and let it brown on each side prior to breaking into pieces. Season with salt and pepper and brown.,Once turkey is cooked through add broccoli, carrots, 1/4 cup of water and steam the veggies until slightly soft, stirring frequently. Once the carrots begin to soften add corn, peas, water chestnuts, crushed red pepper to taste and fresh cracked pepper.,Add stir-fry sauce and chili garlic sauce. Mix together well and serve over rice.,For a low carb option serve over zoodles, Healthy Noodles or riced cauliflower.",,,,,10,37.1,17401,,3,,,Turkey Stir-Fry
167,1,63,25,Breakfast,American,"This protein-packed , is easy and perfect for meal prep or brunch with friends. Using breakfast sausage, egg whites, and fresh veggies you'll have a delicious, nutritious, and show-stopping frittata in 30 minutes.",9,0.2,Southwest Frittata,https://ohsnapmacros.com/wp-content/uploads/2023/03/osm-03-300x300.jpg,14,"[{'amount': '1', 'unit': 'lb.', 'name': 'Jennie-O Turkey Sausage ', 'notes': None}, {'amount': '1', 'unit': 'tsp.', 'name': 'olive oil', 'notes': None}, {'amount': '1', 'unit': None, 'name': 'red bell pepper', 'notes': 'diced'}, {'amount': '1/4', 'unit': None, 'name': 'small red onion', 'notes': 'diced'}, {'amount': '1', 'unit': None, 'name': 'jalapeño', 'notes': 'seeded and chopped'}, {'amount': '1', 'unit': 'tsp.', 'name': 'chili powder', 'notes': None}, {'amount': '1', 'unit': 'tsp.', 'name': 'cumin', 'notes': None}, {'amount': None, 'unit': None, 'name': 'salt and pepper, to taste', 'notes': None}, {'amount': '16', 'unit': 'oz.', 'name': 'liquid egg whites', 'notes': None}, {'amount': '1/2', 'unit': 'cup', 'name': 'shredded cheddar cheese', 'notes': '56 g'}, {'amount': None, 'unit': None, 'name': 'Fresh cilantro ', 'notes': None}, {'amount': None, 'unit': None, 'name': 'Salsa', 'notes': None}, {'amount': None, 'unit': None, 'name': 'Hot sauce', 'notes': None}, {'amount': None, 'unit': None, 'name': 'Greek yogurt', 'notes': None}]","Preheat your oven to 375 degree Fahrenheit. Heat up a 10-inch oven-safe skillet or cast iron with olive oil.,Add the turkey sausage to your preheated skillet, breaking it into small chunks. Cook the meat through, stirring often, until no longer pink. ,Once the meat is cooked, add the bell pepper, onion and jalapeño to the pan with the turkey. Cook, stirring occasionally, until the vegetables are tender, about 5 minutes. Add the chili powder, cumin, salt and pepper and stir to combine. Remove from heat. ,Once the pan is removed from the heat, pour the egg whites over the sausage and vegetable mixture into the skillet. Sprinkle the top with shredded cheddar cheese and transfer to the oven.,Bake for 25 minutes or until egg whites are set and cheese is melted and bubbly. Remove the frittata from the oven and let it cool. Cut your southwest frittata into 8 equal slices and serve with hot sauce, cilantro, salsa, or Greek yogurt in place of sour cream. ",,,,15,5,19,27233,3,8,537,,Southwest Frittata
311,33,,15,Breakfast,American,"This lightened up classic , is out of this world. You will never know this is ground turkey and you surely won’t be lacking any sausage flavors. Ready in under 30 minutes this is a perfectly quick and easy Sunday morning family brunch. ",13,0.1,Turkey Gravy and Biscuits,https://ohsnapmacros.com/wp-content/uploads/2022/12/ezgif.com-gif-maker-49-300x300.jpg,9,"[{'amount': '1', 'unit': None, 'name': '\xa0can Buttermilk Jumbo Biscuits (8 biscuits)', 'notes': None}, {'amount': '1', 'unit': 'lbs.', 'name': '\xa0Jennie-O Lean Turkey Sausage', 'notes': None}, {'amount': '2 1/2', 'unit': 'cups', 'name': 'whole milk', 'notes': None}, {'amount': '1/4', 'unit': 'cup', 'name': 'all-purpose flour', 'notes': None}, {'amount': '1/2\xa0', 'unit': 'tsp.', 'name': 'ground nutmeg', 'notes': None}, {'amount': '1/2', 'unit': 'tsp.', 'name': 'smoke paprika', 'notes': None}, {'amount': '1/4', 'unit': 'tsp.', 'name': 'salt', 'notes': None}, {'amount': '1/4', 'unit': 'tsp.', 'name': '\xa0fresh cracked pepper', 'notes': None}, {'amount': '1/8-1/4', 'unit': 'tsp.', 'name': 'cayenne (not needed but optional if you like extra spicy)', 'notes': None}]","Pre-heat the oven according to the biscuit instructions and bake according to time listed.,While the biscuits bake add the turkey sausage to a pan over medium and brown. While the sausage cooks break into small pieces.,Once the sausage has cooked almost fully through add nutmeg, paprika, salt and pepper. Stir together to evenly coat the meat.,Add 1/4 cup flour to the sausage and mix together until the flour has completely coated the sausage and no longer white.,Slowly add the milk to the sausage and bring to a boil while whisking continuously as to not burn the milk. Once the gravy has started to rapidly boil reduce to a simmer and simmer until the gravy thickens to your desired gravy consistency whisking continuously.,Remove your biscuits from the oven, slice in half and top with 1/2 cup of gravy, approximately 100 grams.,Serving details: Makes approximately 7, 1/2 cup, 100g servings of gravy. Per serving: 141 calories: 11 P / 8 C / 7 Serve with one full biscuit: 311 calories: 14 P / 33 C / 13 F Split everything into 16 servings: 1/2 biscuit and 1/4 cup of gravy = 155 calories: 7 P / 16 C / 7 F",,,,,5,14,19114,,8,776,8.4,Turkey Gravy and Biscuits
384,38,,10,Main Course,"American, Mexican","Meal prep is the key to success when tracking macros. It doesn’t have to be complicated either. These , are flavorful, easy to prep and reheat well. They also have awesome macros.",11,,Turkey Taco Bowl,https://ohsnapmacros.com/wp-content/uploads/2022/12/ezgif.com-gif-maker-2022-11-09T171945.354-300x300.jpg,16,"[{'amount': '4', 'unit': 'oz', 'name': 'ground turkey – measured raw or adjusted for cooked', 'notes': None}, {'amount': None, 'unit': None, 'name': 'Taco Seasoning', 'notes': None}, {'amount': '60', 'unit': 'g', 'name': '\xa0basmati rice', 'notes': None}, {'amount': '60', 'unit': 'g', 'name': 'unsalted black beans, drained and rinsed', 'notes': None}, {'amount': '30', 'unit': 'g', 'name': 'corn', 'notes': None}, {'amount': '30', 'unit': 'g', 'name': 'salsa', 'notes': None}, {'amount': '1/3', 'unit': 'container', 'name': 'of Eat Wholly spicy guacamole*', 'notes': None}, {'amount': None, 'unit': None, 'name': 'juice of 1 lime wedge', 'notes': None}, {'amount': None, 'unit': None, 'name': 'fresh chopped cilantro', 'notes': None}, {'amount': '1', 'unit': 'tsp', 'name': 'salt', 'notes': None}, {'amount': '1', 'unit': 'tsp', 'name': 'onion powder', 'notes': None}, {'amount': '1', 'unit': 'tsp', 'name': 'garlic powder', 'notes': None}, {'amount': '2', 'unit': 'tsp', 'name': 'paprika', 'notes': None}, {'amount': '1', 'unit': 'tbsp', 'name': 'chili powder', 'notes': None}, {'amount': '1.5', 'unit': 'tbsp', 'name': 'cumin', 'notes': None}, {'amount': '1', 'unit': 'tbsp', 'name': 'salsa', 'notes': None}]","Brown your turkey meat with taco seasoning. *,Layer rice in the bottom of your meal prep dish. Top with turkey, beans, corn and lime juice.,If meal prepping – leave off salsa, cilantro and guacamole and add after reheating.",,,,,5,24,19312,,1,,,Turkey Taco Bowl
385,24,,15,Main Course,American,"This ,is a delicious way to get in your protein for the day. Each serving is packed with 60 grams of protein and under 400 calories making it macro friendly and tasty. This recipe is easy, delicious and perfect for a quick weeknight meal or meal prep. The recipes makes 2 servings but can be easily double or tripled.",6,,High Protein Egg Roll In A Bowl,https://ohsnapmacros.com/wp-content/uploads/2022/12/ezgif.com-gif-maker-2022-11-09T161110.866-300x300.jpg,11,"[{'amount': '1', 'unit': 'lbs.', 'name': 'ground turkey (99/1)', 'notes': None}, {'amount': '1/2', 'unit': 'Tbsp.', 'name': 'toasted sesame oil', 'notes': None}, {'amount': '100', 'unit': 'g', 'name': 'broccoli slaw mix', 'notes': None}, {'amount': '1', 'unit': 'Tbsp.', 'name': 'minced garlic', 'notes': None}, {'amount': '3', 'unit': 'Tbsp.', 'name': None, 'notes': '90g'}, {'amount': '150', 'unit': 'g', 'name': 'sliced cabbage', 'notes': None}, {'amount': '75', 'unit': 'g', 'name': 'chopped water chestnuts (1/2 can)', 'notes': None}, {'amount': '1', 'unit': 'tsp.', 'name': 'sriracha', 'notes': None}, {'amount': '1/2', 'unit': 'tsp.', 'name': 'ground ginger', 'notes': None}, {'amount': '1', 'unit': None, 'name': 'chopped green onion', 'notes': None}, {'amount': None, 'unit': None, 'name': 'salt and pepper', 'notes': None}]","Spray cooking pan with nonstick and brown ground turkey in a pan over medium heat. If you end up with a lot of liquid from cooking your meat, drain some. Once browned add 1/2 tsp. sesame oil and stir.,Add minced garlic, broccoli slaw, coconut aminos and stir. Simmer until broccoli is slightly soft. Add cabbage, water chestnuts, sriracha, ginger, salt and pepper. Stir and simmer until cabbage is wilted. Mix in chopped green onions.,Top with extra sriracha, drizzle of coconut aminos or sesame seeds.",,,,,5,60,17411,,2,,,High Protein Egg Roll In A Bowl
