calories,carbohydrates,cholesterol,cook_time,course,cuisine,description,fat,fiber,full_name,image_url,ingredient_count,ingredients,instructions,monounsaturated_fat,notes,polyunsaturated_fat,potassium,prep_time,protein,recipe_id,saturated_fat,serving,sodium,sugar,title
50,11,,1,Drinks,drinks,"Using freshly squeezed orange juice and instant espresso this , is one you'll keep coming back to. Whether it's a summer refresher, afternoon pick me up or an after-dinner mocktail, it's delicious any time of the day and leaves you with zero buzz. ",,,Fizzy Orange Coffee Mocktail (Non-Alcoholic),https://ohsnapmacros.com/wp-content/uploads/2023/12/coffeemocktail-300x300.jpg,8,"[{'amount': '2', 'unit': 'tsp. ', 'name': 'instant espresso powder', 'notes': 'or instant coffee'}, {'amount': '1/4', 'unit': 'cup', 'name': 'cold water', 'notes': None}, {'amount': '1/4', 'unit': 'cup', 'name': 'freshly squeezed orange juice ', 'notes': 'or storebought juice'}, {'amount': '1', 'unit': 'tsp.', 'name': 'maple syrup', 'notes': None}, {'amount': '1/4', 'unit': 'tsp.', 'name': 'vanilla extract', 'notes': None}, {'amount': '1/2', 'unit': 'cup', 'name': 'plain selzter ', 'notes': 'or sparking water'}, {'amount': None, 'unit': None, 'name': 'Ice', 'notes': None}, {'amount': None, 'unit': None, 'name': 'Orange Slice', 'notes': 'garnish'}]","Add the instant espresso powder, cold water, orange juice, maple syrup, and vanilla extract to a small jar. Cover with a tight fitting lid then shake vigorously for 30-60 seconds or until the espresso powder has fully dissolved.,Fill a tall tumbler or Collins glass half full with ice, then pour the shaken espresso mixture over it. Make sure to get the foam as well. ,Top with the seltzer or sparkling water and garnish with an orange slice if desired.",,garnish,,17,5,,42667,,1,1,9,Coffee Mocktail
321,39.4,112.3,10,Main Course,"American, Thai","Who needs take out when you can make these easy , are home. Using a homemade sauce, chicken breast and tons of vegetables you’ll have a delicious meal in under 30 minutes. ",6,1.8,Thai Chicken Noodles,https://ohsnapmacros.com/wp-content/uploads/2022/12/ohsnapmacros-80515-300x300.jpg,19,"[{'amount': '1', 'unit': 'lbs.', 'name': 'chicken breast ', 'notes': 'boneless, skinless'}, {'amount': '1', 'unit': None, 'name': 'large zucchini ', 'notes': '142g'}, {'amount': '1', 'unit': None, 'name': 'red bell pepper ', 'notes': 'thinly sliced'}, {'amount': '1', 'unit': 'tsp.', 'name': 'olive oil', 'notes': None}, {'amount': '1', 'unit': None, 'name': 'garlic clove', 'notes': 'minced'}, {'amount': '1', 'unit': None, 'name': 'egg', 'notes': None}, {'amount': '1', 'unit': None, 'name': 'egg white', 'notes': None}, {'amount': '4', 'unit': 'oz.', 'name': None, 'notes': None}, {'amount': '1/4 ', 'unit': 'tsp.', 'name': 'tapioca flour', 'notes': None}, {'amount': '1/2', 'unit': 'tsp.', 'name': 'water ', 'notes': None}, {'amount': '2', 'unit': 'tbsp.', 'name': None, 'notes': None}, {'amount': '2', 'unit': 'tbsp. ', 'name': None, 'notes': None}, {'amount': '3', 'unit': 'tbsp.', 'name': None, 'notes': None}, {'amount': '1.5', 'unit': 'tbsp. ', 'name': None, 'notes': None}, {'amount': '1/4', 'unit': 'tsp.', 'name': 'garlic powder ', 'notes': None}, {'amount': '14', 'unit': 'g', 'name': 'chopped peanuts', 'notes': 'included in nutrition'}, {'amount': '2', 'unit': None, 'name': 'green onions', 'notes': 'chopped'}, {'amount': None, 'unit': None, 'name': 'cilantro', 'notes': 'optional'}, {'amount': None, 'unit': None, 'name': 'red pepper flakes', 'notes': 'optional '}]","Chop the end off the zucchini and using a spiralizer, slice into zoodles. Place the zoodles on a paper towel, sprinkle with salt and let sit while you prepare the dish. This helps get the moisture out of the zucchini. ,Heat olive oil in a large pan over medium heat. Add garlic and chopped chicken to the hot oil. Cook until the chicken is cooked through. Approximately 5 minutes, stirring often so it cooks through on all sides. ,While the chicken is cooking add all the sauce ingredients to a bowl or jar and combine, slice your red bell pepper into thin strips and cook your noodles. Cook the stir fry noodles according to the package directions (boil for 4-6 minutes and rinse in cold water. Tip: break in half before boiling to help distribute throughout the dish for serving). Be sure to weigh the noodles uncooked. ,Once the chicken has cooked through add the red bell pepper to the pan and sauté for a few minutes to soften the peppers.,Push the chicken and bell pepper mixture off to the side of the pan and add the eggs. Scramble until completely cooked and mix in with the chicken. ,Pat the zoodles dry and cut in half to help distribute throughout the dish to make serving easier. Add the zoodles to the pan with the chicken. ,Add the cooked and drained stir fry noodles and sauce. Mix together well to combine. Let the noodles simmer for a few minutes. Mix the tapioca with water to create a slurry  and add to the dish. Mix together to thicken the sauce. ,Add chopped green onions, cilantro and peanuts. Serve and enjoy! ",2.5,optional ,1.4,655.5,10,43.8,18532,1.2,4,883,4,Thai Chicken Noodles
227,16,,10,Main Course,"American, Chinese","Healthy weeknight dinners don't have to be boring. And with its savory sauce, crisp vegetables and tender ground chicken, this , proves it. This delicious dish is low calorie, low fat, high protein and ready in no time.",6,2,Healthy Ground Chicken Stir Fry Recipe,https://ohsnapmacros.com/wp-content/uploads/2022/11/groundchickenstirfry-300x300.jpg,15,"[{'amount': '1', 'unit': 'lbs.', 'name': None, 'notes': '96/4'}, {'amount': '1/2 ', 'unit': 'cup', 'name': 'shredded carrots', 'notes': None}, {'amount': '1/2', 'unit': 'head', 'name': 'broccoli, chopped', 'notes': '115g'}, {'amount': '3', 'unit': 'oz.', 'name': 'snow peas', 'notes': None}, {'amount': '8', 'unit': 'oz.', 'name': 'whole water chestnuts ', 'notes': 'sliced '}, {'amount': '2', 'unit': None, 'name': 'green onion', 'notes': 'chopped'}, {'amount': None, 'unit': None, 'name': 'salt and pepper', 'notes': 'to taste'}, {'amount': '1/3 + 1/4', 'unit': 'cup', 'name': None, 'notes': None}, {'amount': '1', 'unit': 'tbsp.', 'name': 'lite maple syrup', 'notes': None}, {'amount': '1', 'unit': 'tsp.', 'name': 'sesame oil', 'notes': None}, {'amount': '1/2', 'unit': 'tsp.', 'name': None, 'notes': None}, {'amount': '2', 'unit': None, 'name': 'garlic cloves', 'notes': 'minced'}, {'amount': '1/4', 'unit': 'tsp.', 'name': 'ground ginger', 'notes': None}, {'amount': '1/2', 'unit': 'tsp.', 'name': 'tapioca flour', 'notes': None}, {'amount': '1/2', 'unit': 'tsp.', 'name': 'water', 'notes': None}]","Spray a pan over medium heat with nonstick spray. Add the raw chicken and brown. Break into bite size pieces. ,While the meat is browning prep your stir fry sauce. Add all the ingredients to a jar with a lid and shake to combine. ,Chop the broccoli into bite size pieces and add to a shallow bowl. Add just enough water to cover the bottom of the bowl and place in the microwave for 60 seconds to soften. ,Once the meat has browned add the shredded carrots and broccoli to the pan. Stir and sauté on medium heat for 3-5 minutes. ,Add the stir fry sauce, sliced water chestnuts, chopped green onions and snow peas to the pan. Stir together to get everything evenly combined and bring to a steady simmer. Simmer for 5 minutes. ,Move the meat and vegetables to the side of the pan. Mix 1/2 tsp. of tapioca flour with 1/2 tsp. water in a small bowl and add to the sauce, separate from the meat and veggies. Stir the tapioca slurry in and you will immediately see the sauce begin to thicken. Mix together to evenly coat. ,Top with extra chopped green onions, toasted sesame seeds and / or red pepper flakes. Serve alone, over rice or cauliflower rice or zoodles. Enjoy! ",,,,288,10,25,18402,,4,858,10,Ground Chicken Stir Fry
233,33,46,,Side Dish,American,"This gluten-free , is a holiday season must! Fresh sweet potatoes, warming spices, and a honey walnut topping make this a perfect side dish for any table. This easy, lightened up casserole is a sweet and savory twist on a holiday favorite.",9,5,Gluten-Free Sweet Potato Casserole with Honey Walnut Topping,https://ohsnapmacros.com/wp-content/uploads/2023/10/gfsweetpotatocasserole-20-300x300.jpg,13,"[{'amount': '3.5', 'unit': 'lbs.', 'name': 'sweet potatoes (4-5 potatoes)', 'notes': 'peeled and cut into chunks'}, {'amount': '3', 'unit': 'Tbsp.', 'name': 'butter or coconut oil', 'notes': None}, {'amount': '1/4', 'unit': 'cup', 'name': 'almond milk', 'notes': 'almond, coconut or regular based on preference'}, {'amount': '2', 'unit': 'large', 'name': 'eggs', 'notes': None}, {'amount': '1/3', 'unit': 'cup', 'name': 'honey', 'notes': '113g'}, {'amount': '1', 'unit': 'tsp.', 'name': 'pure vanilla extract', 'notes': None}, {'amount': '1', 'unit': 'tsp.', 'name': 'salt', 'notes': None}, {'amount': '1/2', 'unit': 'tsp.', 'name': 'ground cinnamon', 'notes': None}, {'amount': '1/4', 'unit': 'tsp.', 'name': 'ground nutmeg', 'notes': None}, {'amount': '1/2', 'unit': 'cup', 'name': 'chopped walnuts', 'notes': '60g'}, {'amount': '2', 'unit': 'Tbsp.', 'name': 'honey', 'notes': '42g'}, {'amount': '1/2 ', 'unit': 'tsp.', 'name': 'ground cinnamon', 'notes': None}, {'amount': '1/4', 'unit': 'tsp.', 'name': 'salt', 'notes': None}]","Preheat your oven to 375 degrees Fahrenheit and grease a 9×13-inch casserole dish.  ,In a large pot, cover the sweet potato chunks with water. Bring to a boil, then reduce the heat and simmer until the sweet potatoes are tender when poked with a fork (about 20-25 minutes). Drain and let them cool for a few minutes.,In a large bowl, mash the sweet potatoes with a potato masher or hand-held mixer ensuring a smooth texture. For best results on a super creamy texture, use a hand mixer.,Add butter, milk, eggs, honey, vanilla extract, salt, cinnamon, and nutmeg to the mashed sweet potatoes. Mix until well combined. Transfer the sweet potato mixture into a greased 9×13-inch baking dish.,In a separate bowl, combine the walnuts and honey and mix to evenly combine. Evenly sprinkle the walnuts over the sweet potato mixture followed by cinnamon and salt. I like to pour the cinnamon in my palm and evenly spread it over the top. You will need to work the nuts around the top as they will be sticky. ,Bake in the preheated oven for 25-30 minutes, or until the topping is golden and the casserole is hot. Remove from the oven, serve and enjoy.",2,,3,447,15,5,35475,3,10,293,18,Sweet Potato Casserole
41,,18,50,Main Course,American,"This,is easy, flavorful and extremely versatile. You only need beef, broth and seasonings to have this ready on a busy weeknight. Serve in tacos, on salads, in quesadillas or in a sandwich and use the sauce as a delicious dip. ",2,,Instant Pot Shredded Beef,https://ohsnapmacros.com/wp-content/uploads/2022/11/ohsnapmacros-13191-300x300.jpg,9,"[{'amount': '3', 'unit': 'lbs.', 'name': 'boneless chuck roast', 'notes': None}, {'amount': '2', 'unit': 'tbsp.', 'name': 'olive oil', 'notes': 'split'}, {'amount': '1', 'unit': 'tbsp. ', 'name': 'salt', 'notes': None}, {'amount': '1', 'unit': 'tbsp. ', 'name': 'garlic powder', 'notes': None}, {'amount': '1', 'unit': 'tbsp.', 'name': 'onion powder', 'notes': None}, {'amount': '1', 'unit': 'tbsp. ', 'name': 'chili powder', 'notes': None}, {'amount': '1', 'unit': None, 'name': 'lime', 'notes': 'juiced'}, {'amount': '1', 'unit': 'cup', 'name': 'beef broth', 'notes': None}, {'amount': '1', 'unit': None, 'name': 'handful cilantro', 'notes': 'chopped (optional)'}]","Turn the instant pot on sauté. Trim the fat off your beef and cut into 2 inch chunks and place in a bowl. Add 1 tbsp. of olive oil, garlic powder, salt, onion powder, chili powder and lime juice to the bowl and mix together well to combine. ,Add the second 1 tbsp. olive oil to the instant pot and sauté the beef on all sides until slightly browned but not cooked. ,Add the beef broth to the pot, cover with the lid and seal the release valve. Pressure cook for 30 minutes. ,Let the beef slow release for 20 minutes before quick releasing. Once done you can either shred the beef directly in the pot or remove the beef with a slotted spoon, shred and return. ,To slightly thicken the sauce mix the tapioca flour with water and add to the pot. Mix well to combine. Lastly, add (optional) a handful of chopped cilantro. ,Serve in tacos, sandwiches, on salads or as is. ",1,chopped (optional),,94,10,5,17482,1,53,155,,Instant Pot Shredded Beef
398,44.2,69,10,Main Course,American,"These , are another meal prep winner. Combining lean ground beef, homemade teriyaki sauce and a ton of vegetables you have a hearty and healthy bowl.",9.8,3.2,Teriyaki Beef Bowls,https://ohsnapmacros.com/wp-content/uploads/2023/01/roasted-garlic-cottage-mashed-potatoes-06-300x300.jpg,15,"[{'amount': '1', 'unit': 'lbs.', 'name': 'lean ground beef ', 'notes': '96/4'}, {'amount': '1', 'unit': None, 'name': 'red bell pepper ', 'notes': 'thinly sliced'}, {'amount': '2', 'unit': 'cups', 'name': 'broccoli florettes ', 'notes': 'chopped'}, {'amount': '1/2', 'unit': 'cup', 'name': 'shredded carrots', 'notes': None}, {'amount': '1', 'unit': None, 'name': 'garlic clove', 'notes': 'minced'}, {'amount': '1/3', 'unit': 'cup', 'name': None, 'notes': '100g'}, {'amount': '1', 'unit': 'tsp.', 'name': None, 'notes': None}, {'amount': '1', 'unit': 'Tbsp.', 'name': None, 'notes': None}, {'amount': '1/2', 'unit': 'tsp.', 'name': 'garlic powder', 'notes': None}, {'amount': '1/4', 'unit': 'tsp.', 'name': 'ground ginger', 'notes': None}, {'amount': '10', 'unit': 'oz.', 'name': None, 'notes': None}, {'amount': '1', 'unit': 'package', 'name': None, 'notes': '1 pouch (8.5oz)'}, {'amount': '2', 'unit': 'Tbsp. ', 'name': None, 'notes': None}, {'amount': '2', 'unit': None, 'name': 'green onions', 'notes': 'chopped'}, {'amount': None, 'unit': None, 'name': 'red pepper flakes', 'notes': 'to taste'}]","Heat a pan over medium, spray with cooking spray and add the ground beef. Using a spatula break the beef into bite size pieces as it cooks. Cook until it is fully cooked through and no longer pink in the center approximately 5-7 minutes. ,While the beef cooks add the chopped broccoli to a microwave safe bowl with a splash of water at the bottom. Microwave for 1 minutes to soften some. Once the beef is cooked through add the broccoli, bell peppers, carrots and garlic to the pan. Cook, stirring often until the vegetables have softened. ,Add the sauce ingredients to a bowl and whisk together. Add to the cooked beef and simmer for 5-10 minutes stirring to get everything evenly coated and the sauce soaked into the beef. ,Cook the cauliflower rice and jasmine according to their package instructions. Mix them two together in a bowl. Add chopped green onions, sprinkle of red pepper flakes and additional coconut aminos. Mix together to combine. ,Assemble the teriyaki beef bowls with the rice blend and cooked teriyaki beef. ,For meal prep: each teriyaki beef bowl gets 180 grams of teriyaki beef and 128 grams of rice blend. The recipe makes 4 bowls or servings. Optional, top with additional coconut aminos, red pepper flakes, and chopped green onions as desired. ",1.5,to taste,1.6,427.7,10,30.4,25310,2.5,4,913,15.6,Teriyaki Beef Bowls
179,36,,10,Side Dish,American,"This , is extremely easy, flavorful and can be ready in under 30 minutes. Using pre cooked rice, tons of hidden veggies and fresh mango you’ll have the perfect weeknight side dish the entire family can enjoy. ",2,4,Mango Fried Rice,https://ohsnapmacros.com/wp-content/uploads/2022/10/oshnapmacros-277-300x300.jpg,11,"[{'amount': '2', 'unit': 'bags', 'name': None, 'notes': 'Uncle Bens Microwave Rice '}, {'amount': '12', 'unit': 'oz.', 'name': 'frozen riced cauliflower ', 'notes': None}, {'amount': '1/2', 'unit': 'Tbsp. ', 'name': 'olive oil', 'notes': None}, {'amount': '2', 'unit': 'cups', 'name': None, 'notes': None}, {'amount': '1/4', 'unit': 'cup', 'name': '+ 1 tbsp. coconut aminos ', 'notes': None}, {'amount': '1/2', 'unit': 'Tbsp.', 'name': None, 'notes': 'adjust heat here'}, {'amount': '1', 'unit': 'tsp. ', 'name': 'sesame oil', 'notes': None}, {'amount': '1/4', 'unit': 'tsp.', 'name': 'garlic powder', 'notes': None}, {'amount': '1/2', 'unit': 'tsp.', 'name': 'salt', 'notes': None}, {'amount': '1', 'unit': None, 'name': 'mango', 'notes': 'chopped'}, {'amount': '3', 'unit': None, 'name': 'green onions', 'notes': 'chopped '}]","Prep your rice, riced cauliflower and frozen vegetables prior to starting by either microwaving or cooking on the stove. Drain the excess liquid from the cauliflower and vegetables. ,Heat a large pan over medium. Add olive oil to the pan and heat. Add rice and cauliflower rice and mix to coat well. Add the defrosted vegetables and mix together to combine. ,To the rice mixture add coconut aminos, sesame oil, chili paste, garlic powder and salt. Mix everything together so everything is combined. ,Let the rice burn. You want to let the mixture sit and cook for a while to get crispy prior to stirring. Repeat until you have some crispy burnt pieces of rice throughout the dish. ,Lastly, mix in the chopped mango and green onions and stir to combine. Remove from heat and serve. ",1,chopped ,0.2,281,5,5,16863,0.3,8,371,5,Mango Fried Rice
302,29,90.6,20,Main Course,Italian,"This , is perfectly sauced, effortless to make, and guaranteed to be a family favorite. This tomato based pasta is high in protein from ground chicken and filled with flavor from herbs, spices and simple seasonings. ",8,3,Instant Pot Chicken Spaghetti,https://ohsnapmacros.com/wp-content/uploads/2023/03/osm-55-300x300.jpg,12,"[{'amount': '2', 'unit': 'lbs.', 'name': 'Italian seasoned ground chicken', 'notes': None}, {'amount': '1', 'unit': 'Tbsp.', 'name': 'olive oil', 'notes': None}, {'amount': '8', 'unit': 'oz', 'name': 'Barilla Protein Plus spaghetti', 'notes': 'uncooked, broken in half '}, {'amount': '1', 'unit': 'medium', 'name': 'onion', 'notes': 'diced'}, {'amount': '2', 'unit': 'cloves', 'name': 'garlic', 'notes': 'minced'}, {'amount': '1/2', 'unit': 'tsp.', 'name': 'paprika', 'notes': None}, {'amount': None, 'unit': None, 'name': 'salt and black pepper, to taste', 'notes': None}, {'amount': '1', 'unit': 'medium', 'name': 'zucchini', 'notes': 'shredded'}, {'amount': '2', 'unit': 'cups', 'name': 'low sodium chicken broth', 'notes': None}, {'amount': '1', 'unit': 'can', 'name': 'diced tomatoes, undrained', 'notes': '14.5 oz.'}, {'amount': '1', 'unit': 'can', 'name': 'tomato sauce', 'notes': '8 oz.'}, {'amount': '1/4', 'unit': 'cup', 'name': 'fresh parsley', 'notes': 'chopped'}]","Prepare the ingredients by dicing the onion, mincing the garlic, shredded the zuchinni and breaking the spaghetti in half. Squeeze the moisture out of the shredded zucchini with a paper towel. Turn on the Instant Pot and press the “Sauté” function. Allow the pot to heat up for a minute or two.,Add a tablespoon of olive oil, followed by the onion and garlic. Sauté for 2-3 minutes until the onions become translucent and the garlic is fragrant.,Add the ground chicken to the Instant Pot, along with paprika, salt, and pepper. Sauté, breaking up the chicken into smaller pieces with a spatula, for 5-6 minutes, or until the chicken is cooked through and no longer pink.,Turn off the “Sauté” function. Add the zucchini and stir together to combine. Pour the tomatoes and tomato sauce into the chicken and stir. Add the broken spaghetti on top to the pot, arranging it in a crisscross pattern to minimize sticking.,Pour the chicken broth over the spaghetti. Do not stir. Press down on the spaghetti to ensure it’s submerged in the liquid as best as possible.  Secure the Instant Pot lid and set the pressure release valve to “Sealing.” Select “Manual” or “Pressure Cook” and set the timer for 5 minutes on high pressure.,When the cooking time is up, perform a quick pressure release by carefully turning the pressure release valve to “Venting.” Once the pressure has been released, carefully remove the Instant Pot lid.,Stir the spaghetti to separate the noodles. The sauce will thicken as you stir. If needed, turn on the “Sauté” function for a couple of minutes to reduce the sauce to your desired consistency but note it will continue to thicken as it cools.,Top with fresh chopped parsley, parmesan cheese and enjoy your instant pot chicken spaghetti. ",1.5,chopped,0.4,271,10,28,27713,1.4,8,1076,4.9,Instant Pot Chicken Spaghetti
418,52.5,70,30,Main Course,American,"These , are filled with lean protein, fiber and so much flavor from a homemade peanut sauce. Made with kale and sweet potatoes, these healthy bowls are the best way to meal prep or enjoy an easy weeknight dinner. ",4.6,10.4,High Protein Ground Turkey Bowls with Peanut Sauce,https://ohsnapmacros.com/wp-content/uploads/2023/01/groundturkeybowls-1-1-300x300.jpg,25,"[{'amount': '1 ', 'unit': 'lb.', 'name': 'lean ground turkey', 'notes': '99/1'}, {'amount': '1', 'unit': 'tsp.', 'name': 'chili powder', 'notes': None}, {'amount': '1', 'unit': 'tsp.', 'name': 'smoked paprika', 'notes': None}, {'amount': '1/4', 'unit': 'tsp.', 'name': 'ground turmeric ', 'notes': None}, {'amount': '2', 'unit': None, 'name': 'large sweet potatoes, chopped', 'notes': '948g raw'}, {'amount': '3', 'unit': 'cups', 'name': 'kale, chopped', 'notes': '1 large bunch'}, {'amount': '1/2', 'unit': None, 'name': 'lemon, juiced', 'notes': None}, {'amount': '1', 'unit': 'tsp.', 'name': 'olive oil', 'notes': None}, {'amount': '1/2', 'unit': None, 'name': 'english cucumber, sliced', 'notes': None}, {'amount': '1.5', 'unit': 'cups', 'name': 'cherry tomatoes ', 'notes': None}, {'amount': '1', 'unit': 'cup', 'name': 'sliced carrots', 'notes': None}, {'amount': None, 'unit': None, 'name': 'salt and black pepper ', 'notes': None}, {'amount': '1/2', 'unit': 'cup', 'name': '+ 2 Tbsp. powdered peanut butter PB2 ', 'notes': '52g'}, {'amount': '1/4', 'unit': 'cup', 'name': 'water', 'notes': None}, {'amount': '2', 'unit': 'Tbsp.', 'name': 'lite maple syrup', 'notes': None}, {'amount': '1/2', 'unit': None, 'name': 'lemon, juiced', 'notes': None}, {'amount': None, 'unit': None, 'name': 'dash of cayenne pepper ', 'notes': 'to taste'}, {'amount': None, 'unit': None, 'name': 'pinch of salt ', 'notes': None}, {'amount': '1/2', 'unit': 'cup', 'name': 'apple cider vinegar', 'notes': None}, {'amount': '1', 'unit': 'Tbsp.', 'name': 'honey', 'notes': None}, {'amount': '1 1/2', 'unit': 'tsp. ', 'name': 'kosher salt', 'notes': None}, {'amount': '1', 'unit': 'cup', 'name': 'water', 'notes': None}, {'amount': '1', 'unit': None, 'name': 'red onion', 'notes': 'sliced'}, {'amount': '3', 'unit': None, 'name': 'garlic cloves', 'notes': 'whole'}, {'amount': '1', 'unit': 'Tbsp. ', 'name': 'black peppercorns ', 'notes': None}]","Whisk apple cider vinegar, honey, salt, and 1 cup water in a small bowl until honey and salt dissolve. Place the red onion, garlic and peppercorns in a mason jar with a tight-fitting lid; pour the vinegar mixture over top and let it sit at room temperature for at least 1 hour.,Pre-heat the oven to 425 degrees Fahrenheit. Wash and chop the sweet potatoes into bite size pieces, add to a baking sheet prayed with nonstick cooking spray. Spray the potatoes with cooking spray and season with salt and pepper. Roast for 25-30 minutes until fork tender and browned. ,add the chopped potatoes to a pre-heated air fryer pan. Cook at 400 degrees Fahrenheit for 10-15 minutes until fork tender and browned. Shake the basket halfway through. I personally prefer roasting in the oven because you may need to work in batched with the air fryer depending on the size of your basket. ,While the potatoes roast cook the ground turkey. Heat a pan over medium, spray with cooking spray and add the ground turkey. Using a spatula break the turkey into bite size pieces as it cooks. Cook until it is fully cooked through and no longer pink in the center, approximately 5 minutes. Add the chili powder, smoked paprika and ground turmeric. Stir together to evenly coat and remove from the heat. ,Remove the kale from the stems by slicing along the side of the stem and discarding the stem. Chop into bite size pieces and rinse. Add the rinsed and dried kale to a bowl with the olive oil, salt and lemon juice and using your hands massage the oil into the kale. You will start to notice the texture of the kale changes, softens and shrinks. Once you have massaged the kale for a few minutes and it has decreased in size by about half set aside. ,Combine the powdered peanut butter and water in a bowl and forming a peanut butter paste. Add the remaining ingredients to the bowl and mix together well to combine. Set aside until you’re ready to assemble your bowls. If you want the sauce to be any thinner just add more water. ,Assemble your ground turkey bowls. As always it’s best to weigh your final weights and divide by the numbers of servings for accurate measurements. Ex. weigh your roasted sweet potatoes in grams and divide by 4, that’s how many grams each bowl gets.,Each bowl gets the following: 1/4 ground turkey (approx. 90 grams), 1/4 roasted sweet potatoes (approx. 155 grams), 1/4 kale salad, 4 cherry tomatoes, 4 cucumber slices, 1/4 cup sliced carrots, 37 grams peanut sauce, pickled red onions (if using). ,Nutrition facts without sweet potatoes: 252 calories 38 P / 19 C / 4 F ,Nutrition facts with sweet potatoes: 418 calories 42 P / 52 C / 5 F ",0.8,,0.1,1196,10,42,26035,0.2,4,288.7,23.8,Ground Turkey Bowls
