calories,carbohydrates,cholesterol,cook_time,course,cuisine,description,fat,fiber,full_name,image_url,ingredient_count,ingredients,instructions,monounsaturated_fat,notes,polyunsaturated_fat,potassium,prep_time,protein,recipe_id,saturated_fat,serving,sodium,sugar,title
476,27,,15,Main Course,"American, Chinese","This , is packed with flavors, loaded with protein (55g per serving!) and on your table in under 30 minutes. It has the traditional flavors of stir fry but combines two of my favorite proteins, flank steak and shrimp. ",15,2,Steak and Shrimp Stir Fry,https://ohsnapmacros.com/wp-content/uploads/2022/12/ezgif.com-gif-maker-43-300x300.jpg,13,"[{'amount': '1.5', 'unit': 'lbs.', 'name': 'Flank Steak', 'notes': None}, {'amount': '1', 'unit': 'lbs.', 'name': 'frozen Medium waterfront BISTRO Shrimp Raw Peeled & Deveined Tail Off', 'notes': None}, {'amount': '1', 'unit': None, 'name': 'package Bens Original Jasmine Ready Rice Side Dish – 8.5 OZ', 'notes': None}, {'amount': '1', 'unit': 'tsp.', 'name': 'olive oil for cooking', 'notes': None}, {'amount': '1/3', 'unit': 'cup', 'name': '(95g) Coconut Aminos', 'notes': None}, {'amount': '1', 'unit': 'Tbsp.', 'name': '\xa0Dijon Mustard', 'notes': None}, {'amount': '1', 'unit': None, 'name': 'package Stir-Fry Broccoli (12 oz.)\xa0', 'notes': None}, {'amount': '3', 'unit': None, 'name': 'green onions, chopped', 'notes': None}, {'amount': '1/2', 'unit': 'cup', 'name': '(140g) Coconut Aminos', 'notes': None}, {'amount': '1', 'unit': 'Tbsp.', 'name': None, 'notes': None}, {'amount': '1', 'unit': 'tsp.', 'name': 'ground ginger', 'notes': None}, {'amount': '1', 'unit': 'tsp.', 'name': 'garlic powder', 'notes': None}, {'amount': '1', 'unit': None, 'name': 'lime, juiced', 'notes': None}]","Slice flank steak into strips against the grain.,In a zip lock or resealable bag add all steak marinade ingredients (coconut aminos, sesame oil, lime juice, ginger, garlic) and sliced steak. Lay flat in the fridge for at least 4 hours to marinade. I like to do this first thing in the morning so that it can marinade all day before dinner.,Remove frozen shrimp from the package and place in a large bowl of warm, not hot, water. Let the shrimp defrost. You may need to drain the water and add fresh warm water 1 to 2 times to get the shrimp to fully defrost.,While the shrimp defrosts cook the steak. Add 1 tsp. olive oil to a pan over medium high heat. Once the oil is hot add the steak and sear on both sides for approximately 3 minutes on each side. You want to sear the steak but not over cook it.,Once the steak is cooked remove from the pan and set aside leaving all the juice from the steak in the pan.,Add defrosted shrimp directly to the pan of steak juice. Cook until they become pink and no longer translucent. Once cooked add to the plate with the steak.,Pour out the remaining liquid from the pan once you remove the shrimp.,Add the bag of vegetable to a microwave safe bowl halfway full of water and cook for 3-5 minutes until the vegetables are fork tender while not being to soft. You want them slightly al dente.,Once the vegetables are steamed add to the hot pan with 1/3 cup of coconut aminos and 1 Tbsp. dijon mustard and simmer.,While the vegetable simmer cook the rice in the microwave according to the package instructions.,Pour cooked rice into the pan and mix together well to combine. Add shrimp and steak back to the pan. Top with chopped green onions and mix everything together well and cook for a few minutes to ensure the steak and shrimp are warm.,Top your steak and shrimp stir fry with sesame seeds, additional green onions, red chili pepper flakes and/or dijon mustard.",,,,,10,55,19097,,5,1140,,Steak and Shrimp Stir Fry
176,19,,,Main Course,American,"This versatile , is loaded with protein, flavor and a perfect time saver for busy nights and weekends. It is made with simple everyday ingredients like black beans, chicken breast and corn. Make one pot and serve it endless ways throughout the week, whether by itself, over rice, in a wrap or on a bun this chicken makes a great easy meal prep. ",3,4.9,Creamy Southwest Chicken Crockpot Recipe,,8,"[{'amount': '1', 'unit': 'lbs.', 'name': 'chicken breast, raw', 'notes': None}, {'amount': '1', 'unit': None, 'name': 'can black beans (15oz.), drained and rinsed', 'notes': None}, {'amount': '1', 'unit': None, 'name': '\xa0can corn (15oz.), drained', 'notes': None}, {'amount': '1', 'unit': None, 'name': '\xa0can (10oz) Rotel® Original Diced Tomatoes & Green Chilies', 'notes': None}, {'amount': '1/2', 'unit': 'cup', 'name': 'salsa', 'notes': None}, {'amount': None, 'unit': None, 'name': 'Salt & Pepper to taste', 'notes': None}, {'amount': None, 'unit': None, 'name': 'Juice of half a lime', 'notes': None}, {'amount': None, 'unit': None, 'name': 'Optional: 2 oz. 1/3 less fat cream cheese', 'notes': None}]","Add chicken to the bottom of a crockpot. Season with salt, pepper and juice of half a lime.,Top the chicken with beans, corn, rotel and salsa. Cover and set on low for 4.5 hours or high for 2.,When the chicken is fully cooked shred inside the crockpot with a fork and mix together well. Chicken should shred easily.,Optional: add 2 oz. cream cheese directly to the crockpot and mix together until the cream cheese is fully melted and combined with the chicken.,Nutrition Facts w/out cream cheese: 159 calories: 22 P / 18 C / 1 F Nutrition Facts w/ cream cheese: 176 calories: 23 P / 19 C / 3 F Serving size remains the same.",,,,,10,23,17210,,8,665,,Southwest Chicken Crockpot
98,3,,10,Breakfast,American,"This , will be your new favorite breakfast recipe. Made with juicy blueberries, sweet pancake syrup and flavorful pork and chicken, this sweet and savory combo is the perfect addition to any plate.",5,,Blueberry Breakfast Sausage,https://ohsnapmacros.com/wp-content/uploads/2022/12/ezgif.com-gif-maker-42-300x300.jpg,6,"[{'amount': '1', 'unit': 'lb.', 'name': 'pork sausage', 'notes': None}, {'amount': '1', 'unit': 'lb.', 'name': None, 'notes': '96% lean'}, {'amount': '1', 'unit': 'cup ', 'name': 'fresh blueberries', 'notes': None}, {'amount': '1/4', 'unit': 'cup', 'name': None, 'notes': None}, {'amount': '1/2', 'unit': 'tsp.', 'name': 'dried thyme', 'notes': None}, {'amount': '1/2', 'unit': 'Tbsp.', 'name': 'olive oil', 'notes': None}]","Add pork, chicken, syrup and thyme to a large bowl and mix well. Use your hands to get the pork and chicken to combine.,Place your blueberries in a microwave safe bowl and microwave for 30 seconds to soften. Slightly mash the blueberries with the back of a fork. You don't want to turn this into a liquid but more of a very chunky sauce.,Fold blueberries carefully into the pork and chicken sausage mixture.,Heat a large cast iron skillet over medium heat and add 1/2 Tbsp. olive oil. Once the oil is hot, add the sausage patties. Use a 1/4 cup measuring cup (2 oz. each) and add the sausage into the pan. Flatten into patties. You should be able to fit approximately 6 patties in a large cast iron.,Cook on both sides until the sausages are cooked through. Approximately 5 minutes on each side. Once cooked, remove and set aside. Begin your next batch. Repeat. Recipe makes approximately 17-18 sausages.",,,,,5,10,188,,18,197,,Blueberry Breakfast Sausage
347,29,,2,"Main Course, Snack",American,"These , are easy to prep for a busy week and extremely cost effective. Using pre grilled chicken, veggies and powdered PB2 you will have a flavor packed meal in under 10 minutes. ",6,,Peanut Chicken Wraps,https://ohsnapmacros.com/wp-content/uploads/2022/12/ezgif.com-gif-maker-65-300x300.jpg,11,"[{'amount': '2', 'unit': None, 'name': ""Joseph's Lavash (full – can swap with your favorite see notes)"", 'notes': None}, {'amount': '6', 'unit': 'oz.', 'name': 'cooked chicken breast', 'notes': None}, {'amount': '1/2', 'unit': 'cup', 'name': 'sliced green cabbage', 'notes': '65g'}, {'amount': '1/2', 'unit': 'cup', 'name': 'sliced red cabbage', 'notes': '65g'}, {'amount': '1/4', 'unit': None, 'name': 'medium bell pepper, thinly sliced', 'notes': '50g'}, {'amount': None, 'unit': None, 'name': 'Shaved carrot – using potato peeler', 'notes': '20g'}, {'amount': None, 'unit': None, 'name': 'Chopped green onion', 'notes': None}, {'amount': '4', 'unit': 'tbsp.', 'name': 'powdered PB2', 'notes': '26g'}, {'amount': '4', 'unit': 'tsp.', 'name': None, 'notes': '20g'}, {'amount': None, 'unit': None, 'name': 'Red Pepper Flakes', 'notes': None}, {'amount': '2', 'unit': 'tbsp. ', 'name': 'Water', 'notes': None}]","In a small bowl whisk together peanut sauce ingredients and set aside.,Chop and prep veggies and chicken.,Lay out lavash or wrap of choice flat and top with veggies, chicken and peanut sauce. Wrap like a burrito and enjoy. Makes 2 wraps.",,,,,10,45,19161,,2,,,Peanut Chicken Wraps
140,34,,,Side Dish,American,"These crispy , are the perfect side dish for busy weeknights. They're a delicious combo of sweet and spicy, are easy to make and cook in less than 25 minutes.",0.3,5,Sweet and Spicy Air Fryer Carrots and Potatoes,https://ohsnapmacros.com/wp-content/uploads/2022/07/airfryercarrotsandpotatoes-300x300.jpg,8,"[{'amount': '1', 'unit': 'lbs.', 'name': 'golden potatoes, quartered', 'notes': None}, {'amount': '1', 'unit': 'lbs.', 'name': 'large carrots, chopped', 'notes': None}, {'amount': '1', 'unit': 'Tbsp.', 'name': 'olive oil', 'notes': None}, {'amount': '2', 'unit': None, 'name': 'garlic cloves, minced', 'notes': None}, {'amount': '2', 'unit': 'Tbsp.', 'name': 'lite maple syrup', 'notes': None}, {'amount': None, 'unit': None, 'name': 'Salt and Pepper', 'notes': None}, {'amount': None, 'unit': None, 'name': 'Red Pepper Flakes', 'notes': None}, {'amount': None, 'unit': None, 'name': 'Parsley for garnish', 'notes': None}]","Pre heat the air fryer.,While the air fryer heats chop potatoes into quarters or smaller if big. You want bite size pieces. Peel and chop your carrots into chunks.,Add the carrots and potatoes to a bowl and mix with 1 Tbsp. olive oil. Be sure to evenly coat the carrots and potatoes.,Add the carrots and potatoes to the air fryer and cook at 400 degrees Fahrenheit for 12 minutes.,Remove the carrots and potatoes from the air fryer and place back in the bowl you used to cover in olive oil. Add maple syrup, garlic, pinch of salt and pepper and red pepper flakes to taste. I do about 3-4 good shakes.,Return to the air fryer and cook for another 10 minutes until the carrots and potatoes are fork tender. Top with chopped parsley and enjoy.",,,,,,3,19090,,4,93,,Air Fryer Carrots and Potatoes
145,18,,10,Main Course,"American, Mexican","These , are an easy weeknight dinner, packed with sweet and spicy flavors and high in protein. With tender shrimp, avocado crema and a homemade mango corn salsa, this delicious recipe is light, fresh and totally tasty. ",2,8.5,The Best Air Fryer Shrimp Tacos with Homemade Mango Salsa,https://ohsnapmacros.com/wp-content/uploads/2022/07/OHSNAPMACROS-206-300x300.jpg,14,"[{'amount': '1.5', 'unit': 'lbs.', 'name': 'raw jumbo shrimp, tails off and deveined', 'notes': None}, {'amount': '1', 'unit': 'tsp.', 'name': 'smoked paprika', 'notes': None}, {'amount': '1', 'unit': 'tsp.', 'name': 'ground cumin', 'notes': None}, {'amount': '1', 'unit': 'tsp.', 'name': 'chili powder', 'notes': None}, {'amount': '1/2', 'unit': 'tsp.', 'name': 'salt', 'notes': None}, {'amount': '6', 'unit': None, 'name': 'flour tortillas', 'notes': None}, {'amount': None, 'unit': None, 'name': 'shredded cabbage', 'notes': None}, {'amount': '1/2', 'unit': None, 'name': 'can corn', 'notes': '150g'}, {'amount': '1', 'unit': None, 'name': 'small mango', 'notes': 'chopped, 140g'}, {'amount': '2', 'unit': None, 'name': 'small vine tomatoes', 'notes': 'chopped, 200g'}, {'amount': '1/2', 'unit': None, 'name': 'red onion', 'notes': 'finely sliced, 100g'}, {'amount': '1', 'unit': 'cup', 'name': '\xa0fresh cilantro', 'notes': None}, {'amount': None, 'unit': None, 'name': 'juice of 1 lime', 'notes': None}, {'amount': '1/2', 'unit': 'Tbsp.', 'name': 'salt', 'notes': None}]","For the salsa: add the corn, mango, tomatoes, red onion, and cilantro to a bowl and refrigerate for at least an hour before serving.,Preheat the air fryer while you prep your shrimp. If you’re using frozen shrimp add them to a large bowl and fill with room temperature water to defrost, swap out the water if needed and let them sit until fully defrosted. If not already done, remove the tails and devein the shrimp. Pat dry and add to a large mixing bowl.,In a separate small bowl, mix together the paprika, cumin, chili powder and salt and add to the shrimp. Mix well so the shrimp is evenly coated.,Add the shrimp in a single layer to the air fryer and cook at 390 degrees Fahrenheit for 4-6 minutes until they're pink and no longer translucent. Flip the shrimp halfway through.,Over a open flame on the stove sear the tortillas and top with shredded cabbage, shrimp, mango corn salsa (65g) and desired additional toppings.",,,,,15,19,17204,,6,,,Air Fryer Shrimp Tacos
385,24,,15,Main Course,American,"This ,is a delicious way to get in your protein for the day. Each serving is packed with 60 grams of protein and under 400 calories making it macro friendly and tasty. This recipe is easy, delicious and perfect for a quick weeknight meal or meal prep. The recipes makes 2 servings but can be easily double or tripled.",6,,High Protein Egg Roll In A Bowl,https://ohsnapmacros.com/wp-content/uploads/2022/12/ezgif.com-gif-maker-2022-11-09T161110.866-300x300.jpg,11,"[{'amount': '1', 'unit': 'lbs.', 'name': 'ground turkey (99/1)', 'notes': None}, {'amount': '1/2', 'unit': 'Tbsp.', 'name': 'toasted sesame oil', 'notes': None}, {'amount': '100', 'unit': 'g', 'name': 'broccoli slaw mix', 'notes': None}, {'amount': '1', 'unit': 'Tbsp.', 'name': 'minced garlic', 'notes': None}, {'amount': '3', 'unit': 'Tbsp.', 'name': None, 'notes': '90g'}, {'amount': '150', 'unit': 'g', 'name': 'sliced cabbage', 'notes': None}, {'amount': '75', 'unit': 'g', 'name': 'chopped water chestnuts (1/2 can)', 'notes': None}, {'amount': '1', 'unit': 'tsp.', 'name': 'sriracha', 'notes': None}, {'amount': '1/2', 'unit': 'tsp.', 'name': 'ground ginger', 'notes': None}, {'amount': '1', 'unit': None, 'name': 'chopped green onion', 'notes': None}, {'amount': None, 'unit': None, 'name': 'salt and pepper', 'notes': None}]","Spray cooking pan with nonstick and brown ground turkey in a pan over medium heat. If you end up with a lot of liquid from cooking your meat, drain some. Once browned add 1/2 tsp. sesame oil and stir.,Add minced garlic, broccoli slaw, coconut aminos and stir. Simmer until broccoli is slightly soft. Add cabbage, water chestnuts, sriracha, ginger, salt and pepper. Stir and simmer until cabbage is wilted. Mix in chopped green onions.,Top with extra sriracha, drizzle of coconut aminos or sesame seeds.",,,,,5,60,17411,,2,,,High Protein Egg Roll In A Bowl
59,11,,2,"Appetizer, Salad, Side Dish, Snack",American,"Skip the dairy, nuts and oil and try this simple Oil Free Pesto. I love a good ,and the flavors it adds to pastas, wraps and pizzas. I was determined to figure out a pesto that didn’t break the macro bank but gave me everything I craved. This pesto does the trick. It’s garlicky and lemony and packs a punch. Try it on your next pizza, sandwich, wrap or mix it with some laughing cow wedges and make a creamy pasta. ",,,Oil Free Pesto,https://ohsnapmacros.com/wp-content/uploads/2022/12/ezgif.com-gif-maker-71-300x300.jpg,7,"[{'amount': '2', 'unit': 'cups', 'name': 'fresh basil (2 oz.)', 'notes': None}, {'amount': '2', 'unit': 'cups', 'name': 'spinach', 'notes': None}, {'amount': '1/2', 'unit': None, 'name': 'large lemon juiced', 'notes': None}, {'amount': '4', 'unit': None, 'name': '\xa0cloves of garlic', 'notes': None}, {'amount': '1', 'unit': 'Tbsp.', 'name': 'water', 'notes': None}, {'amount': None, 'unit': None, 'name': 'pinch of salt', 'notes': None}, {'amount': None, 'unit': None, 'name': 'fresh cracked pepper', 'notes': None}]","Place all ingredients in a high speed blender (I use a single serve smoothie blender cup) or a food processor if you'd like the pesto chunky.,Blend until you reach the desired texture. Taste and season with additional salt and pepper as needed. You could also add cracked red pepper for some spice.,Recipe makes roughly 140 grams of sauce. The entire jar of sauce is 59 calories and 11 carbs. Split into 10 servings this is 6 cals and 1 carb. Considering you're not going to use the entire jar at once, I think we can all agree this is a free sauce.,Nutrition facts listed are for the entire jar.",,,,,10,6,19178,,1,,,Oil Free Pesto
145,2,,30,Main Course,American," is spicy, delicious and so easy! Made with homemade cajun seasoning and ready in the air fryer in under 10 minutes, you'll have a great prepped protein for all your meal prep needs. ",3,,Air Fryer Blackened Chicken,https://ohsnapmacros.com/wp-content/uploads/2021/12/DSC02639-1-300x300.jpg,6,"[{'amount': '1', 'unit': 'lbs.', 'name': '\xa0chicken breast', 'notes': None}, {'amount': '1', 'unit': 'Tbsp.', 'name': 'smoked paprika', 'notes': None}, {'amount': '1', 'unit': 'Tbsp.', 'name': 'garlic powder', 'notes': None}, {'amount': '1', 'unit': 'tsp.', 'name': '\xa0salt', 'notes': None}, {'amount': '1/2', 'unit': 'tsp.', 'name': 'black pepper', 'notes': None}, {'amount': '1/4 to 1', 'unit': 'tsp.', 'name': 'cayenne pepper', 'notes': None}]","Mix seasonings in a deep mixing bowl and set aside.,Slice chicken breast into strips. Add chicken to bowl of seasonings and mix together well to evenly coat.,Preheat air fryer. Lay chicken in air fryer without any pieces overlapping. Cook at 380 for 8 minutes.,You can also pan sear, bake or BBQ this chicken. If baking – either cut into strips or leave in whole breasts and bake at 375 for approx. 20-25 minutes until cooked through and no longer pink. If BBQing – pound chicken breasts to approximately 1/2 inch thick. Top with the seasonings and coat well on all sides. BBQ on both sides until cooked through, approximately 4-5 minutes each side. If pan searing – suggest cutting into strips and searing a hot cast iron until cooked through.",,,,,10,26,19246,,4,,,Air Fryer Blackened Chicken
424,46,,25,Main Course,Mexican,"These , are easy, flavorful and 1 pan makes 4 days worth of food. Prep everything on Sunday and you’re ready to go for most of your week ahead.",7,,Spicy Sheet Pan Fajita Bowls,https://ohsnapmacros.com/wp-content/uploads/2022/12/ezgif.com-gif-maker-2022-11-09T162051.970-300x300.jpg,16,"[{'amount': '1.5', 'unit': 'lbs.', 'name': 'chicken breast, sliced into strips', 'notes': None}, {'amount': '1', 'unit': None, 'name': 'red bell pepper, sliced', 'notes': '140g'}, {'amount': '1', 'unit': None, 'name': 'orange bell pepper, sliced', 'notes': '140g'}, {'amount': '1', 'unit': None, 'name': 'red onion, sliced', 'notes': '290g'}, {'amount': '1', 'unit': 'tbsp.', 'name': '\xa0lime juice', 'notes': None}, {'amount': '1', 'unit': 'tbsp.', 'name': 'honey', 'notes': None}, {'amount': '1', 'unit': 'tbsp.', 'name': 'chili powder', 'notes': None}, {'amount': '1', 'unit': 'tbsp.', 'name': 'cumin', 'notes': None}, {'amount': '2', 'unit': 'tsp.', 'name': 'paprika', 'notes': None}, {'amount': '1', 'unit': 'tsp.', 'name': 'garlic powder', 'notes': None}, {'amount': '1', 'unit': 'tsp.', 'name': 'salt', 'notes': None}, {'amount': '1', 'unit': 'tsp.', 'name': 'pepper', 'notes': None}, {'amount': '360', 'unit': 'g', 'name': 'cooked basmati rice', 'notes': None}, {'amount': '2', 'unit': 'tbsp.', 'name': 'chopped cilantro', 'notes': None}, {'amount': None, 'unit': None, 'name': 'Juice of 1 lime', 'notes': None}, {'amount': None, 'unit': None, 'name': 'Pinch of salt', 'notes': None}]","Preheat over to 425.,For meal prepping and measuring purposes I split the chicken and veggies into 2 separate bowls. Mix all dry seasonings in a small bowl. Split in half. Add 1/2 the seasoning to the chicken and half to the peppers and onions. Add 1/2 tbsp of lime and 1/2 tbsp honey to each bowl. Mix to coat everything well.,Spray a baking sheet with cooking spray and spread out chicken and veggies to bake. Bake at 425 for 20-25 minutes until cooked through.,Combine rice, cilantro, lime and salt.,4 oz. cooked chicken 100g veggies 90g cilantro lime basmati rice 424 Cals: 46.4 C / 7.2 F / 45.4 P",,,,,10,45,19277,,4,,,Sheet Pan Fajita Bowls
421,50,,15,Main Course,Italian,"Do you ever cook with bok choy? It is one of my favorite vegetables and so underutilized. This , brings such flavor and texture. I also love that you can find the small baby size ones which makes this recipe so easy to prep for. One little bok choy for everyone! ",15,,Simple Sausage and Bok Choy Pasta,https://ohsnapmacros.com/wp-content/uploads/2022/12/ezgif.com-gif-maker-88-300x300.jpg,7,"[{'amount': '2', 'unit': 'oz', 'name': 'mild ground Italian Sausage', 'notes': None}, {'amount': '1/2', 'unit': 'tsp', 'name': 'minced garlic', 'notes': None}, {'amount': '1', 'unit': None, 'name': 'baby bok choy, chopped', 'notes': None}, {'amount': '1', 'unit': None, 'name': 'handful (50g) sliced crimini mushrooms', 'notes': None}, {'amount': '1/2', 'unit': 'cup', 'name': 'chicken broth', 'notes': None}, {'amount': '2', 'unit': 'oz', 'name': '\xa0cooked pasta of choice, measured uncooked', 'notes': None}, {'amount': None, 'unit': None, 'name': 'salt and pepper', 'notes': None}]","Cook Italian sausage in a pan over medium. Once fully cooked remove from the pan and set aside. Add in bok choy, mushrooms and garlic and sauté for a few minutes until garlic is fragrant. Add salt and pepper and chicken broth. Let simmer in chicken broth until the vegetables are softened and most of the liquid has evaporated.,Add 2 oz. cooked pasta of choice and sausage to the pan and mix together. Enjoy.",,,,,10,22,19228,,1,,,Simple Sausage and Bok Choy Pasta
305,24,,20,Main Course,American,"Sheet Pan Chicken is one of my favorite dishes to meal prep. It’s not only delicious, the combinations are endless but it only uses one pan. I am all about convenience and the less dishes the better in my opinion. This , recipe is one that will be on repeat in your house! You can also use the honey mustard sauce for other recipes like pork chops, air fryer chicken … catch my drift? Recipes coming soon!",2,,Honey Mustard Sheet Pan Chicken and Veggies,https://ohsnapmacros.com/wp-content/uploads/2022/12/ezgif.com-gif-maker-82-300x300.jpg,6,"[{'amount': '1.5', 'unit': 'lbs', 'name': 'chicken breast (raw)', 'notes': None}, {'amount': '4', 'unit': 'cups', 'name': '(332 grams) frozen green beans*', 'notes': None}, {'amount': '4', 'unit': 'tbsp', 'name': 'honey', 'notes': None}, {'amount': '1/3', 'unit': 'cup', 'name': 'Dijon mustard', 'notes': None}, {'amount': '1', 'unit': 'tbsp', 'name': 'minced garlic', 'notes': None}, {'amount': None, 'unit': None, 'name': 'salt and pepper', 'notes': None}]","Remove chicken from package and butterfly into thin cut slices. I use 2 breast and cut into a total of 4 ~ 6 oz. pieces. Trim any excess fat.,Pre heat oven to 375 degrees F.,Line frozen green beans around the outside of a baking dish. Lay chicken breasts in the center.,In a small bowl mix together all honey mustard sauce ingredients and pour on top of the chicken.,Bake 375 degrees F for 20 minutes until the chicken is fully cooked.,Mix the green beans into the sauce.,Serve as is or over rice, noodles, zoodles or potatoes. The chicken is also delicious in a salad.",,,,,10,58,19211,,4,,,Honey Mustard Sheet Pan Chicken and Green Beans
341,37,,25,Main Course,American," are an easy way to get a complete meal in one easy bake. Fresh salmon, tender broccoli and sliced potatoes are layered together and baked in foil. The coconut amino and sweet chili sauce make a flavorful and simple glaze to complete this easy and delicious healthy dinner. ",9,,Single Serving Salmon Foil Packs,https://ohsnapmacros.com/wp-content/uploads/2022/02/salmonfoilpackets-2-300x300.jpg,5,"[{'amount': '4', 'unit': 'oz.', 'name': 'fillet of salmon', 'notes': 'raw'}, {'amount': '1/2', 'unit': None, 'name': 'small potato', 'notes': 'very thinly sliced, 100g'}, {'amount': '1', 'unit': 'cup', 'name': 'broccoli', 'notes': 'chopped, 100g'}, {'amount': '1', 'unit': 'Tbsp.', 'name': 'coconut aminos (or soy sauce)', 'notes': None}, {'amount': '1', 'unit': 'Tbsp.', 'name': 'sweet and spicy soy chili sauce ', 'notes': None}]","Pre heat oven to 400 F. Lay foil out on a baking sheet.,Thinly slice potatoes, you could also use a mandolin here to ensure they are thin enough. Lay along the center of the foil.,Top potatoes with salmon filet and surround the salmon with broccoli.,Pour coconut aminos (or soy sauce) on top of the salmon and drizzle the Sweet & Spicy Soy Chili Sauce directly on top.,Tent with a second piece of foil and secure edges to close the pack up tightly.,Bake at 400 for 20 minutes until the salmon is fully cooked. If your salmon filets do not easily flake with a fork when you remove them from the oven place them back in the oven for another 3-5 minutes until the meat easily flakes with a fork.,Unwrap and enjoy! We eat it directly out of the pack. ",,,,,5,30,19199,,1,,,Salmon Foil Packs
